group,title,coding
politics_filtered_nov19,"'Up is down, down is up': Trump did Russia's job for it by firing Chris Krebs, and Krebs' removal is the biggest sign of his success",
politics_filtered_nov20,An anonymous group of top US CEOs said they would hold off acting against Trump until after the Georgia recount. It's done.,
politics_filtered_nov21,"The Perils of Not Prosecuting Trump Joe Biden is wary of a legal reckoning against his predecessor, but to let Trump go would be to sanction future corruption.",
conservative_filtered_nov21,Anti-Trump Legal Team Withdraws In Pennsylvania,
conservative_filtered_nov19,Trump Campaign Lawyers: There Is a Pattern of Planned Voter Fraud in Multiple States,
politics_filtered_nov19,'Integrity matters': Meet the lone Republican election official standing up to his party and Trump,
politics_filtered_nov19,Trump team admits to keeping Biden officials in dark over Covid vaccine plan,
conservative_filtered_nov19,Former US president Donald Trump campaign drops Michigan lawsuit,
conservative_filtered_nov21,"Whatever Happens In The Next Few Weeks, Brothers and Sisters, Remember This Clip, My Favorite 60 seconds of Trump: 'I am your voice'",
politics_filtered_nov21,Opinion: Hold President Trump accountable for his misdeeds,
politics_filtered_nov19,Biden vote tally getting close to 80 million,
politics_filtered_nov21,Trump goes golfing in middle of G20 summit,
politics_filtered_nov21,No Take Backs! Blackburn Spox Says GOPer Didn’t Mean To Call Biden President-Elect,
conservative_filtered_nov20,"After Death Threats At Pro-Trump Rally, Milwaukee Health Inspectors Will Get Police Escorts",
politics_filtered_nov21,Letters to the Editor: Stop Donald Trump's coup. Impeach him again,
politics_filtered_nov21,"Trump forges ahead with frantic effort to overturn election | Having exhausted many of his legal options, Trump is looking at other ways to subvert Joe Biden’s victory.",
politics_filtered_nov21,Wisconsin officials: Trump observers obstructing recount,
politics_filtered_nov21,Joe Biden Turns 78 and Will Be the Oldest President — After Trump Broke the Record Right Before Him,
conservative_filtered_nov20,Satire: Obama Horrified As Trump Undoes His Years Of Hard Work Bombing The Middle East,
conservative_filtered_nov19,"NYT Columnist Admits ‘Trump Was Right,’ Dems ‘Wrong’ On Crucial COVID Policy | The Daily Wire",
politics_filtered_nov20,"Kavanaugh should face new investigation, Biden transition official Barbara McQuade wrote",
politics_filtered_nov19,"Biden's top unification task: Expose Trump team wrongdoing, restore trust in government - Biden needs a government-wide audit to find every ounce of Trump administration mismanagement and corruption. Unity hinges on transparency and trust.",
conservative_filtered_nov19,BLM Thug Who Sucked-Punched Trump Supporter Is a Convicted Child Rapist,
politics_filtered_nov19,Biden to name Treasury nominee ‘acceptable to all elements of the party’ around Thanksgiving,
politics_filtered_nov21,Trump appointed judges in Florida overturn ban on conversion therapy for minors,
politics_filtered_nov19,"Giuliani Presser Was ‘Most Dangerous’ TV In US History, Says Security Expert Trump Fired",
conservative_filtered_nov20,"'We are a nation of laws, not tweets': Republican Sens. Romney and Sasse decry Trump efforts to challenge election",
politics_filtered_nov19,“It’s the Trump Bubble”: The Right Has Created a Wave of COVID Patients Who Don’t Believe It’s Real,
conservative_filtered_nov21,"Georgia Gov. Kemp Calls for Audit, Says Trump Can Demand New Recount",
politics_filtered_nov21,Trump has longstanding history of calling elections 'rigged' if he doesn’t like the results,
conservative_filtered_nov21,"Rudy and Sidney’s Krakentastic Spectacle, and What It Could Mean -- A dismissive legacy media might have panned Team Trump’s press conference Thursday, but it was a significant moment with significant portents.",
politics_filtered_nov20,"Mitt Romney on Trump: ‘It is difficult to imagine a worse, more undemocratic action by a sitting American President’",
politics_filtered_nov20,"Trump Is Rushing Through His Biggest, Most Dangerous Arms Deal. Congress Could Stop It.",
conservative_filtered_nov20,"Michigan, 6:31 AM, 150,000 votes, 96% for Biden...nothing to see here",
conservative_filtered_nov21,Biden certified Georgia winner after hand recount,
politics_filtered_nov20,"No, You Do Not Have to Feel the Trump Voter's Pain — There is no reason, after five and half years of untruths, dog-whistles, slurs and conspiracies, and weeks of Trump trying to undermine Biden’s win, to hug the people who want to disenfranchise you.",
politics_filtered_nov21,Cuomo tells Biden $500 billion in stimulus funds needed to bail out states,
conservative_filtered_nov20,"While You Were Focused on The Kraken, the Senate Continued Confirming Trump Federal Judges",
politics_filtered_nov19,"'We Simply Cannot Afford Half-Measures': Outside DNC, Progressives Demand Biden Go Big for Green New Deal",
politics_filtered_nov21,"Rudy Giuliani's quixotic frenzy has observers wondering if he may need Trump's protection | ""One explanation? He needs a pardon and he's trying to earn it,"" a CNN analyst says",
conservative_filtered_nov21,Biden Mocks a Reporter for Asking a Question as Biden's Staff Tries to Get the Press Out of There,
politics_filtered_nov20,Georgia certifies that Joe Biden won the recount,
conservative_filtered_nov21,"Joe Biden: Why Are Reporters Asking Me Questions? On Friday, Biden appeared dumbfounded as to why a reporter was asking the projected Democratic presidential-elect a question as the press pool was being scurried away by staff.",
politics_filtered_nov21,Wisconsin officials: Trump observers obstructing recount,
politics_filtered_nov19,An unusually easy Trump debunking: There was no suspicious vote dump in Wisconsin,
politics_filtered_nov19,Why Trump Should Not Have Access to U.S. Intelligence After January 20,
politics_filtered_nov19,Republican-leaning U.S. Chamber of Commerce urges Trump to stop delaying transition to Biden administration,
politics_filtered_nov21,'A Disgrace': Trump's DOJ Schedules Three More Federal Executions in Days Before Anti-Death Penalty Biden Takes Office,
politics_filtered_nov21,"Trump addresses virtual G-20 summit, heads out before session on pandemic",
conservative_filtered_nov21,"LIVE: March for Trump in Atlanta, Georgia",
politics_filtered_nov20,Trump meets with Michigan GOP leaders in dubious bid to overturn Biden’s election,
politics_filtered_nov21,Trump refuses to take questions after falsely claiming he won election in first media appearance in weeks. No sitting US president has falsely claimed an election victory from the Brady Briefing Room. Until Friday,
politics_filtered_nov19,Trump is the true perpetrator of election fraud,
politics_filtered_nov19,Census Officials Say They Can’t Meet Trump’s Deadline for Population Count | Officials have concluded the Census Bureau won’t have data on time to carry out the administration’s goal of stripping unauthorized immigrants from population totals for apportionment.,
conservative_filtered_nov19,"Biden taps son Hunter as Food Drug Commissioner. “I don’t know about the food part, but my boy knows drugs.""",
politics_filtered_nov19,'It was not pressure': Trump called a Michigan county official who now says she wants to rescind her vote to certify the election,
politics_filtered_nov19,"Georgia election official says hand tally of presidential race is complete, the results affirm Biden’s lead over Trump",
conservative_filtered_nov21,Gregg Jarrett Has an Important Reminder for the Media About the Trump Campaign's Evidence of Voter Fraud,
politics_filtered_nov19,Trump and allies have sought to exclude 1 of every 10 votes in key states,
politics_filtered_nov20,Sen. Lamar Alexander says no evidence of voter fraud: Biden should receive briefings,
politics_filtered_nov21,"Shame the Random, Unknown Government Officials Aiding Trump’s Coup Attempt",
politics_filtered_nov20,Top House Democrats Demand Biden Transition Briefing From GSA Chief,
politics_filtered_nov20,"There's 'not a legal' or political path for Trump to remain in office, says Gore recount lawyer",
politics_filtered_nov21,Wisconsin Officials: Trump Observers Obstructing Recount,
politics_filtered_nov20,"As Trump gets more brazen about trying to steal the election, can congressional Republicans ditch him?",
politics_filtered_nov21,Ivanka Trump distances self from dad’s election fraud claims as her own legal jeopardy grows,
politics_filtered_nov20,Romney says he can't imagine 'a more undemocratic action' than what Trump's done,
politics_filtered_nov20,Trump trade advisor makes wild claim China sent ‘thousands of people around the world’ to spread Covid,
politics_filtered_nov21,Michigan and Georgia Republicans Just Crushed Trump’s Coup Dreams,
politics_filtered_nov20,Georgia confirms a Biden win while Trump targets Michigan,
conservative_filtered_nov19,Here's How Much Biden's Gun Tax Could Cost Every Day Americans,
conservative_filtered_nov21,Donald Trump returns to the White House briefing room claiming he 'won' and suggests Pfizer held back vaccine to sabotage his election and says without him the drug would have taken four YEARS,
politics_filtered_nov19,Trump turns to blocking state certification of U.S. election results after court losses,
politics_filtered_nov19,Georgia confirms Biden victory and finds no widespread fraud after statewide audit,
politics_filtered_nov19,"There's 'not a legal' or political path for Trump to remain in office, says Gore recount lawyer",
politics_filtered_nov20,Trump invites Michigan GOP state lawmakers to White House as legal challenges there fail,
politics_filtered_nov20,Joe Biden turns 78 today as he’s about to become the oldest sitting president,
politics_filtered_nov21,"Plagued by COVID outbreaks, the meatpacking industry could be forced to change under Biden",
politics_filtered_nov21,"U.S. Sen. Marsha Blackburn, a Trump ally, refers to Biden as 'president-elect'",
conservative_filtered_nov19,Lin Wood bombshell: 'Irrefutable evidence' of fraud in Georgia recount -- Attorney assisting campaign claims Trump won reelection in '70%-plus landslide',
conservative_filtered_nov21,Lawyer working on Trump Pennsylvania effort placed under official protection due to threats,
politics_filtered_nov21,"Ivanka Trump: How Dare You Investigate My Father for Tax Fraud, Which He Definitely Didn’t Use Me to Commit",
politics_filtered_nov20,Report: Trump reached out to GOP Wayne County canvassers who are now looking to reverse decision,
politics_filtered_nov19,Republican mayor from Michigan: ‘President Trump is deliberately lying to Americans’,
conservative_filtered_nov20,Joe Biden Keeps Lead in Georgia After Recount; Giuliani Says Recount ‘Means Nothing’,
conservative_filtered_nov20,Elected DNC Member Floats Re-Education Camps for Trump Supporters,
conservative_filtered_nov21,"While You Were Focused on The Kraken, the Senate Continued Confirming Trump Federal Judges",
politics_filtered_nov21,Arizona’s largest county certifies Biden win over Trump,
conservative_filtered_nov20,Romney: Surprising People Believe Trump's Fraud Claims,
conservative_filtered_nov19,Trump Announces a Press Conference and a ‘Viable Path to Victory’,
conservative_filtered_nov20,"Georgia recount results: Biden still ahead by 12,000 — but Trump has one last roll of the dice",
politics_filtered_nov19,Trump summons Michigan GOP leaders for extraordinary meeting,
politics_filtered_nov20,Donald Trump Undercuts American Democracy as he clings to power,
politics_filtered_nov19,"Trump campaign drops Michigan election lawsuit, Rudy Giuliani says",
politics_filtered_nov21,Twitter will transfer presidential accounts to Joe Biden on Inauguration Day,
politics_filtered_nov19,Buttigieg: Denying Biden intelligence briefings is about protecting Trump's 'ego',
politics_filtered_nov21,Rudy Giuliani's Son Potentially Exposed Most of Trump's Legal Team to COVID During RNC Press Conference,
conservative_filtered_nov19,9 Key Points from Trump Campaign Press Conference on Challenges to Election Results,
conservative_filtered_nov20,Lin Wood: President Trump won 400 electoral votes | One America News Network,
politics_filtered_nov19,Trump's vaccine team will not brief Biden administration,
politics_filtered_nov20,Trump’s press secretary Kayleigh McEnany heckled in briefing: ‘When will you admit you lost?’,
conservative_filtered_nov19,'Keep fighting': Second Trump rally in Washington set to protest electoral college vote,
politics_filtered_nov20,New York expands Trump tax fraud investigations to include writeoffs: report,
politics_filtered_nov19,Trump invites Michigan GOP state lawmakers to White House as legal challenges there fail,
conservative_filtered_nov19,One Of Biden’s First Admin Hires Helped Push Through China Trade Bill That Caused ‘Sharp Drop’ In US Jobs,
politics_filtered_nov19,‘My Blood Is Boiling’: Ex-GOP Governor Torches Trump For Stonewalling Biden’s Transition,
politics_filtered_nov19,Trump's vaccine team will not brief Biden administration: U.S senator,
conservative_filtered_nov21,"Catholics sounding alarm about Biden administration, conflicts with moral teachings",
politics_filtered_nov21,Detroit asks judge to sanction Trump campaign for spreading 'disinformation',
politics_filtered_nov19,Duluth airport refused to host Pence event after Trump rally flouted safety rules,
conservative_filtered_nov21,Twitter says it will hand control of US president's official account to Joe Biden on January 20 - regardless of whether Donald Trump has left the White House,
politics_filtered_nov19,"Giuliani, Trump Legal Team Melt Down In Insane Presser",
politics_filtered_nov19,"We Still Live In 2 Americas, Not 1 - The 2020 election saw more rich people vote for Trump then four years ago, while Joe Biden attracted more poor and low-income voters.",
politics_filtered_nov21,Judge slaps down Trump appointee who has sought to reshape Voice of America and related agencies,
politics_filtered_nov21,"Merrick Garland Among Biden Candidates For Attorney General, Sources Say",
politics_filtered_nov19,Trump’s Last-Ditch Bid to Steal the Election: Install Loyal Electors,
politics_filtered_nov20,A new beginning: We will survive our bad breakup with Donald Trump,
politics_filtered_nov21,Trump's defeat by Joe Biden has triggered a huge wave of relief among the United States' European allies,
politics_filtered_nov19,Social Security Defenders Tell Biden to Keep Austerity-Obsessed Bruce Reed Far Away From the White House,
politics_filtered_nov21,Trump’s failure to work with Biden is becoming more urgent as Covid spreads,
politics_filtered_nov20,Trump’s election lawsuits plagued by elementary errors,
politics_filtered_nov19,"Mike Shirkey, a Michigan Republican who will meet with Trump, said this week he would not override Biden’s victory.",
conservative_filtered_nov21,'No national shutdown': Joe Biden says shutting down the virus will not require a national lockdown,
politics_filtered_nov21,Michigan Republican leader is meeting with Trump at White House to discuss coup,
conservative_filtered_nov20,"Embarrassing Lapdog Biden Journalists Debase Their Profession in Latest Presser: ""What did you say to Americans, especially immigrant Americans who came to the United States, looking for political stability and are seeing all the things that the President is doing?""",
conservative_filtered_nov20,"Sidney Powell: Absent software fraud, Trump 'had at least 80 million votes'",
conservative_filtered_nov20,Trump Campaign Says It Has Uncovered Enough ‘Fraud’ To Overturn Election Result,
politics_filtered_nov21,Georgia Secretary of State Certifies Biden’s Win After Audit,
politics_filtered_nov21,A new lawsuit alleges Trump’s effort to overturn Michigan’s election results disenfranchises Black voters,
politics_filtered_nov21,Trump’s last-ditch efforts to overturn results fail to make dent in Biden victory,
politics_filtered_nov19,Donald Trump mounts all-out assault on election result in Michigan | President calls county officials in attempt to derail Biden victory | Plans to fly Republican lawmakers to meet with him in DC,
conservative_filtered_nov19,Dear Joe Biden: are you kidding me? | Erin Brockovich,
conservative_filtered_nov21,Ilhan Omar Urges Biden to ‘Reverse’ President Trump’s Middle East Agreements -- Thinks that peace between Israel and Arab nations is a bad thing.,
politics_filtered_nov21,Who needs Russia? Loudest attacks on US vote are from Trump,
politics_filtered_nov20,Poll: 61 percent of voters say it's important that Trump give concession speech,
conservative_filtered_nov20,Satire: Obama: 'Biden Has Touched Us All',
politics_filtered_nov21,"Twitter will hand @POTUS to Biden on Inauguration Day, even if Trump doesn’t concede",
conservative_filtered_nov19,Trump Legal Team Holds Presser: ‘Trump Won In A Landslide. We Are Going To Prove It’ | The Daily Wire,
politics_filtered_nov21,The Cabinet Appointments That Really Matter In The Incoming Biden Administration,
politics_filtered_nov20,Georgia Secretary of State to certify election for Biden,
politics_filtered_nov21,Trump to lose @POTUS Twitter account on January 20,
politics_filtered_nov21,A destructive legacy: Trump bids for final hack at environmental protections,
politics_filtered_nov21,"Trump considers targeting birthright citizenship with executive order in his last weeks in office, report says",
politics_filtered_nov20,Biden Must Keep His Word and Allow Investigations of Trump to Proceed,
politics_filtered_nov19,Trump-Appointed Judge Rejects Lin Wood’s ‘Creative’ Election Lawsuit in Georgia,
politics_filtered_nov21,Trump tries to leverage power of office to subvert Biden win,
politics_filtered_nov19,"Georgia Releases Hand Recount Results, Affirming Biden's Lead",
politics_filtered_nov19,Trump to Biden transition must start immediately: Chamber of Commerce,
politics_filtered_nov20,Detroit Asks Court to Issue Sanction After Trump Campaign Lawyer Used Court Filing to ‘Spread Disinformation’,
politics_filtered_nov20,A Trump speechwriter who was sacked in 2018 for meeting white nationalists has been rehired to oversee US Holocaust memorials,
politics_filtered_nov21,Trump Campaign Lawyers File New Pennsylvania Motion Which Misspells Governor’s Name,
conservative_filtered_nov20,"4th witness, also a Democrat saw perfect black marks on a stack of ballots ... 500 in a row all for Biden",
politics_filtered_nov21,Federal Judge Strikes DOJ from the Docket in E. Jean Carroll’s Case Against Donald Trump,
politics_filtered_nov19,Trump campaign's stream of Giuliani press conference includes audio of people mocking him,
politics_filtered_nov21,US Chamber of Commerce chief calls on Trump to stop delaying transition to Biden presidency,
conservative_filtered_nov21,Lin Wood: President Trump won 400 electoral votes | One America News Network,
politics_filtered_nov20,AOC and Cori Bush Join Protest Outside DNC to Push Biden on Climate Action,
politics_filtered_nov19,Biden Maintains His Lead Over Trump as Georgia Recount Ends,
conservative_filtered_nov21,Trump Touts New Rules to 'End Global Free Loading' of Prescription Drugs,
politics_filtered_nov20,Trump Continues To Falsely Downplay COVID After US Death Toll Reaches 250k,
politics_filtered_nov21,Latinas for Trump founder unseated Florida Democrat after ‘shadow candidate’ with his surname entered the race,
conservative_filtered_nov20,9 Key Points from Trump Campaign Press Conference on Challenges to Election Results,
politics_filtered_nov21,Detroit voters sue Donald Trump over unsubstantiated claims of voter fraud,
politics_filtered_nov21,Bypassing McConnell: Democrats push Biden to aggressively use executive power,
politics_filtered_nov20,"Once Out Of Office, Trump Faces Significant Legal Peril",
conservative_filtered_nov21,Trump lawyers cited Minnesota counties in affidavit about Michigan: report,
conservative_filtered_nov20,Biden marks Transgender Day of Remembrance,
politics_filtered_nov19,Trump's firing of top election security official unsettles lawmakers,
politics_filtered_nov20,"Republican Party sparks backlash with ""Trump won by a landslide"" post: ""What happened to you?""",
politics_filtered_nov20,It’s time for everyone to pick a side: America or President Trump,
politics_filtered_nov20,Biden set to meet with democratic leaders on Capitol Hill,
politics_filtered_nov20,NY probes Trump consulting payments that reduced his taxes,
politics_filtered_nov20,"Georgia election official says hand tally of presidential race is complete, the results affirm Biden’s lead over Trump",
conservative_filtered_nov20,Trump To Release “Clear Path To Victory” Today At High Noon!,
politics_filtered_nov20,Tucker Carlson bashes Trump attorney Sidney Powell for lack of evidence in fraud claims: ‘She never sent us any’,
politics_filtered_nov21,‘Do they just not care?’ Miami immigrants troubled by surge of Latino support for Trump,
politics_filtered_nov21,It’s time for everyone to pick a side: America or President Trump,
conservative_filtered_nov20,"Georgia certifies election results, making Biden win official",
politics_filtered_nov21,Twitter says it’s handing @POTUS account over to Joe Biden on Inauguration Day,
politics_filtered_nov19,Non-Giuliani Trump Attorneys Admit Trump’s Claims of Election Fraud Are Bullshit,
conservative_filtered_nov19,AZ GOP Chair Dr. Kelli Ward Confident Election ‘Will Ultimately Be Decided in Favor of President Donald J. Trump’,
politics_filtered_nov21,Most Republicans greet Trump’s push to overturn the election with a customary response: Silence,
politics_filtered_nov20,Trump's Stupid Coup—Which Hasn't Failed Yet—Is Distracting Us From What Needs to Be Done,
conservative_filtered_nov21,"Obama to produce Netflix series about Trump transition, unclear whether it will include abusing intel agencies to spy on successor",
conservative_filtered_nov20,Georgia Secretary of State Certifies Biden’s Win After Audit,
politics_filtered_nov21,"GOP Sen. Blackburn Calls Biden President-Elect, but Later Takes it Back",
politics_filtered_nov20,Donald Trump Is Endangering America's National Security for His Ego,
conservative_filtered_nov19,"3rd monitor, a Democrat: ""Hundreds of these ballots seemed impeccable, with no folds or creases. The bubble selections were perfectly made ... only observed selections in black ink, and all happened to be selections for Biden.""",
conservative_filtered_nov19,"In Nevada, A Corrupt Cash-For-Votes Scheme Is Hiding In Plain Sight -- In tribal areas, Native American nonprofits illegally offered gift cards, electronics, and other 'prizes' in an effort to get out the vote—for Joe Biden.",
conservative_filtered_nov19,"Georgia Republican Poll Watcher Discovered Recount Error Off By More Than 9,000 Votes Wrongly Given To Biden",
politics_filtered_nov20,Trump objects to counting thousands of Wisconsin ballots,
politics_filtered_nov21,Pete Buttigieg May Be Contender For Biden’s Cabinet | NBC News NOW,
conservative_filtered_nov19,"Sidney Powell: Absent software fraud, Trump 'had at least 80 million votes'",
politics_filtered_nov19,Here’s a Timeline of the Presidential Certification Process That Trump Is Trying to Disrupt,
politics_filtered_nov21,"Wall Street Journal Bails on Trump’s ‘Conspiracy Theory,’ Says Giuliani is Not a ‘Serious Practicing Attorney",
conservative_filtered_nov20,Joe Biden stays silent over proposed meeting with BLM founder,
conservative_filtered_nov20,Joe Biden Holds Lead in Georgia After Hand Recount,
politics_filtered_nov21,Georgia governor certifies presidential electors for Biden,
politics_filtered_nov21,Georgia certifies that Joe Biden won the recount,
conservative_filtered_nov20,"After Insulting Trump Voters For Years, NYT Writer Complains Reaching Out To Them Is A 'Waste Of Time'",
politics_filtered_nov20,Biden calls Trump ‘most irresponsible president in American history’,
politics_filtered_nov21,Trump Is No Longer the Problem. His Army of Followers Is.,
conservative_filtered_nov21,"How Christianity Gained Cultural Momentum In The Trump Era -- Some celebrities are not just talking the talk, but they seem to be walking a walk that seems to counter what Hollywood culture promotes and accepts.",
politics_filtered_nov21,Trump Is Staging a Comically Incompetent Coup — It would almost be possible to laugh at this debacle if the stakes weren’t so serious.,
politics_filtered_nov21,"Most GOP Senators Stay Mum on Trump's Efforts to Challenge Election, After Washington Post Contacted All 53 of Them",
politics_filtered_nov21,"Biden will receive @POTUS Twitter account on Jan. 20 even if Trump doesn't concede, company says",
politics_filtered_nov19,'Integrity still matters': the unlikely Republican standing up to Trump's voter fraud lies,
conservative_filtered_nov20,National Democratic Party official suggests re-education for Trump supporters: 'How do you deprogram 75 million people?',
politics_filtered_nov21,'Call His Bluff': Edward Norton's Viral Message On Trump,
politics_filtered_nov21,"Trump attacks big Pharma, announces programs to lower drug prices",
politics_filtered_nov20,Biden campaign sees no legal basis for overturning Michigan result,
politics_filtered_nov20,Democrats send letter to GSA head Emily Murphy demanding to know why the Biden-Harris transition has not begun,
conservative_filtered_nov21,Bigot: Joe Biden Lackey Wanted to Destroy Amy Coney Barrett Because She's Catholic,
politics_filtered_nov20,"Georgia recount complete, and Biden is still the winner",
politics_filtered_nov21,Republican Senator Lamar Alexander urges Trump to begin Biden transition,
