group,title,coding
conservative_filtered_nov19,'They want Kamala in there tomorrow': Limbaugh says Dems to dump Biden -- 'They have no intention of this guy serving a full 4-year term',
politics_filtered_nov19,Texas Republican Rep. Will Hurd shames Trump for firing cybersecurity chief Christopher Krebs,
politics_filtered_nov21,‘My Frustration Turned Into Anger.’ Some Americans Who Lost Family Members to COVID-19 Have Turned Against Donald Trump,
politics_filtered_nov19,"What has Donald Trump been doing since the US election loss? Tweeting, golfing and watching TV, apparently",
politics_filtered_nov20,Joe Biden and Kamala Harris honour the 37 trans Americans murdered this year with vow to end epidemic of violence,
politics_filtered_nov20,NY probes Trump consulting payments that reduced his taxes,
politics_filtered_nov20,Georgia Secretary of State to certify election for Biden,
politics_filtered_nov20,"In Georgia, get-out-the-vote operations that helped Biden win haven’t stopped",
conservative_filtered_nov19,BREAKING: Georgia manual recount confirms Biden victory,
conservative_filtered_nov20,[Not Satire] National Democratic Party official suggests re-education for Trump supporters: 'How do you deprogram 75 million people?',
politics_filtered_nov21,NAACP Federal Suit: Trump Violated Voting Rights Act,
politics_filtered_nov20,Trump is trying to overturn an election he didn't win. We didn't get here by accident,
politics_filtered_nov19,Georgia official: Vote audit over; Biden still leads Trump,
politics_filtered_nov21,Biden Must Keep His Word and Allow Investigations of Trump to Proceed,
politics_filtered_nov21,"After Trump meeting, Michigan GOP leaders say Biden's win still stands",
politics_filtered_nov19,Trump is trying to stop local officials in key swing states from certifying election results in a last-ditch effort to block Biden,
politics_filtered_nov21,Merrick Garland is being considered for Attorney General in the Biden administration,
conservative_filtered_nov20,"Kavanaugh should face new investigation, Biden transition official Barbara McQuade wrote",
politics_filtered_nov21,Judge bars Trump appointee from interfering in Voice of America,
politics_filtered_nov20,"Giuliani, Trump Legal Team Melt Down In Insane Presser",
politics_filtered_nov19,Trump unlikely to get census data in time to exclude undocumented from representation,
conservative_filtered_nov20,About 73% Biden Vote Margin Gain in PA from Areas Given $18 Million by Zuckerberg-Funded ‘Safe Elections’ Project,
conservative_filtered_nov19,Audit Confirms President-Elect Biden Wins State of Georgia.,
conservative_filtered_nov20,Tucker Carlson​ says Trump attorney Sidney Powell wouldn't provide him with any evidence of election fraud. Powell hits back.,
politics_filtered_nov19,‘Blood On His Hands’: Mary Trump Says Her Uncle Must Be ‘Held To Account’ The president’s niece said he is “directly responsible for the deaths of thousands of Americans.,
politics_filtered_nov20,Federal Judge Strikes DOJ from the Docket in E. Jean Carroll’s Case Against Donald Trump,
conservative_filtered_nov19,"4th witness, also a Democrat saw perfect black marks on a stack of ballots ... 500 in a row all for Biden",
conservative_filtered_nov19,DNC Member Rants: ‘Deprogram’ 75 Million Trump Supporters,
politics_filtered_nov20,Republicans aren't scared of the Trump &amp; Rudy show — they love this stuff. Republicans aren't staying quiet because they fear Trump — this clown-car coup has nothing but upside for them,
politics_filtered_nov21,I met ‘monster’ reality TV star Donald Trump 16 years ago. The reality of him has been monstrous . . .,
politics_filtered_nov21,Trump Owned By Parody Twitter Account He Apparently Believed Was His Sister’s,
politics_filtered_nov19,Biden says Trump challenge to his election victory is 'totally irresponsible',
conservative_filtered_nov20,Butterball Releases Turkey With Biden-Harris Logo So You Can Just Say Your Thanksgiving Gathering Is A Political Rally,
conservative_filtered_nov20,AOC to Biden Administration: 'Keep Your Promise' on $2T Green New Deal,
politics_filtered_nov20,Trump’s lawsuits plagued by spelling errors: ‘I’ve never seen an election lawyer handle a case as poorly as Giuliani has’,
politics_filtered_nov19,Trump campaign says ‘hackers’ sabotaged livestream to comment on Giuliani hair dye dripping down his face | ‘Unauthorized users’ were heard on the Trump campaign live stream mocking the brown streaks running down Giuliani’s face,
politics_filtered_nov19,Biden team belittles ‘spectacle’ of sweaty Trump lawyer Rudy Giuliani pushing vote fraud conspiracy claims,
conservative_filtered_nov21,"Biden stuggles with words at press conference -- 'I'm going to ... employ the defense, reconstruct the act'",
politics_filtered_nov20,Trump advisers reportedly think Rudy Giuliani is encouraging election lawsuits so he can get paid,
conservative_filtered_nov19,Trump campaign lawyer under protection following ‘threats of harm’,
politics_filtered_nov20,"Romney on Trump election tactics: 'Difficult to imagine a worse, more undemocratic action' by president",
conservative_filtered_nov19,Jennifer Dillon crunched the data to s̵t̵e̵e̵r̵ ̵ steal Biden’s success,
conservative_filtered_nov20,Paul Krugman spotted doing a quick economic one-eighty with 'Biden boom' prediction,
conservative_filtered_nov21,Harvard Students Demand That Trump Officials Be Preemptively Barred From Campus,
politics_filtered_nov19,Are you sure Trump's plan to steal the election has failed? You shouldn't be,
conservative_filtered_nov19,Satire: Biden Getting Excited As Segregation Coming Back Into Style,
conservative_filtered_nov19,"Trump Campaign Withdrawing Lawsuit in Michigan After Wayne County ‘Relief,’ Says Giuliani",
politics_filtered_nov19,Georgia recount complete; Biden still the winner,
politics_filtered_nov19,Biden's incoming chief of staff says Trump 'failing to follow the law' by not letting transition begin,
politics_filtered_nov19,Michigan Republicans Are Helping Trump Try to Steal the State’s Election,
politics_filtered_nov20,Donald Trump Is Leaving Behind Blueprints to End Democracy,
politics_filtered_nov19,Biden: Trump's actions send 'damaging' message to rest of world,
politics_filtered_nov20,"Biden, top Democrats lay groundwork for multibillion dollar push to boost U.S. broadband",
politics_filtered_nov20,"‘It's difficult to imagine a worse, more undemocratic action by a sitting American President': Mitt Romney rips Trump for his latest efforts to subvert the election",
conservative_filtered_nov19,"Majority of voters say special counsel should be convened to investigate Biden, Ukraine dealings",
politics_filtered_nov20,NY probes President Trump's consulting payments that reduced his taxes,
politics_filtered_nov20,Obama joked that Trump might have to get dragged out of the White House by Navy SEALs if he keeps refusing to concede,
politics_filtered_nov21,Why Can Trump Try To Steal The Election? Blame The Electoral College.,
conservative_filtered_nov20,Lawyer working on Trump Pennsylvania effort placed under official protection due to threats,
conservative_filtered_nov19,Democrats And Media Are Reaping Fruit Of 4 Years Of Anti-Trump Conspiracy Theories,
conservative_filtered_nov20,Satire: Biden Getting Excited As Segregation Coming Back Into Style,
politics_filtered_nov19,Donald Trump’s Effort To Steal The Election Is Comically Stupid — And Extremely Dangerous,
conservative_filtered_nov20,"After UN ‘Database’ Targets Israeli Settlements, Trump Administration to Blacklist BDS Supporters",
politics_filtered_nov21,Judge rules against Trump global media chief after firings,
conservative_filtered_nov21,Michigan AG Suggests Criminally Charging Republican Legislators for Meeting With Trump,
politics_filtered_nov19,"Georgia recount complete, and Biden is still the winner",
conservative_filtered_nov19,Trump Admin Brings Hammer Down on 'Anti-Semitic' Movement Targeting Israel,
politics_filtered_nov19,Rudy Giuliani straight-up asked a federal judge to ignore Pennsylvania voters and declare Trump won the state,
politics_filtered_nov19,Judge Halts Trump Administration’s Eighth Federal Execution,
conservative_filtered_nov19,Giuliani: 'Massive Fraud' Used to Steal Election From Trump,
politics_filtered_nov19,"Trump asks judge to declare him winner in Pennsylvania despite trailing by 80,000 votes",
politics_filtered_nov20,Trump Fraud Investigations Now Include Tax Write-offs for Ivanka,
conservative_filtered_nov19,"After Death Threats At Pro-Trump Rally, Milwaukee Health Inspectors Will Get Police Escorts",
conservative_filtered_nov20,Catholic Archbishop Sends Dire Warning to Trump About the Radical ‘Great Reset’ Movement,
politics_filtered_nov20,Trump’s lawyers confused MN and MI vote counts in affidavit intending to prove voter fraud,
politics_filtered_nov20,"If Biden Forgives First $20K of Student Loans, It Erases Debt For 55% of Borrowers",
politics_filtered_nov19,Trump Is Going Overboard in His Final Days. He Should Just Disappear—Go Golfing and Leave Our Government Alone,
politics_filtered_nov21,Trump Organization's consulting payments to Ivanka Trump are focus of NY tax probe,
politics_filtered_nov19,Trump Is Banking on Republican Legislators Ignoring Will of the People. Legal Experts Say It’s ‘Exceedingly Unlikely to Work.’,
politics_filtered_nov21,Trump’s lawsuits plagued by spelling errors: ‘I’ve never seen an election lawyer handle a case as poorly as Giuliani has’,
politics_filtered_nov19,"Pat Robertson prays for Satan to stop making people believe Joe Biden won the election — “In the name of Jesus, I bind the spirit of delusion that has come across our land... I still think Trump’s gonna ultimately win.”",
conservative_filtered_nov21,6 Big Claims by Trump’s Lawyers About Overturning Election Results,
politics_filtered_nov19,"Biden, Harris to meet with governors, Trump again has no public events",
politics_filtered_nov21,Senators who urged ‘voters to decide’ impeachment won’t admit Trump lost the election,
conservative_filtered_nov20,"Trump Campaign Withdrawing Lawsuit in Michigan After Wayne County ‘Relief,’ Says Giuliani",
politics_filtered_nov21,'GOP made a bed of nails': Scaramucci on Republicans appeasing Trump,
politics_filtered_nov20,Republicans Truly Don't Care That Trump Is Undermining Democracy,
politics_filtered_nov21,White Nationalist Appointed by Trump to Holocaust Commission Praised Jeffrey Epstein for Not Being “a Pussy”,
politics_filtered_nov20,Trump’s Indifference Amounts to Negligent Homicide,
politics_filtered_nov19,Trump Campaign’s Jenna Ellis Mocked Election Law Expert for Being Right. Then the Trump Campaign Proved Him Right.,
politics_filtered_nov20,Dominion counters Trump legal team after press conference claims: 'No ties to Venezuela or Cuba',
politics_filtered_nov21,The Desperate Final Gasps of Team Trump’s Flailing ‘Mini-Coup’,
conservative_filtered_nov21,Opinion | Georgia Certifies: Donald Trump Lost,
conservative_filtered_nov20,The Hill’s Joe Concha Takes Blowtorch to Pro-Biden ‘Marshmallow Media’,
politics_filtered_nov20,Trump’s fury grows as US election loss becomes unequivocal,
politics_filtered_nov19,Weissmann: Citizen Trump should be prosecuted for obstructing Special Counsel Mueller,
politics_filtered_nov21,Georgia secretary of state certifies election results that show state’s voters chose Joe Biden for president,
politics_filtered_nov20,Edward Norton: Trump 'throwing a wicked pout fest' over election,
politics_filtered_nov19,"Rudy Giuliani sweats profusely, falsely accuses Biden of ‘horrible’ crimes during bizarre press conference",
politics_filtered_nov19,"Did Trump drain the swamp? Watchdog gives him an F, while Biden starts with a C",
politics_filtered_nov20,"If Biden Wants to Be Like F.D.R., He Needs the Left | Radical agitation helped bring Social Security and much of the New Deal into being.",
politics_filtered_nov20,"Biden looks to rehire diplomats, others fired by Trump to rebuild State Department",
conservative_filtered_nov19,Giuliani: Trump Campaign Drops Michigan Lawsuit,
politics_filtered_nov19,Wisconsin Democratic election official: Don't water Trump's 'plant of baloney',
politics_filtered_nov20,"Merrick Garland Among Biden Candidates For Attorney General, Sources Say",
politics_filtered_nov19,Trump Is Salting the Soil of American Democracy,
politics_filtered_nov19,Trump campaign asks Pennsylvania court to declare Trump winner,
politics_filtered_nov21,"Let's count the ways Donald Trump has tried to subvert this election, shall we?",
politics_filtered_nov19,Georgia election official says hand tally of presidential race is complete and results affirm Biden’s lead over Trump,
conservative_filtered_nov19,"Trump lawyers lay out voter fraud cases in Pennsylvania, Michigan and Wisconsin",
politics_filtered_nov21,"Donald Trump says 'I won, by the way' and lashes out at Pfizer claiming it delayed news of the COVID-19 vaccine until after the election",
politics_filtered_nov20,Michigan Senate Leader Shirkey swarmed by activists at airport before flying to meet with Trump,
conservative_filtered_nov19,'We no longer have' an 'honest press' -- Commentator: Media 'casually compares Trump to Hitler' because it's 'what they believe',
politics_filtered_nov20,Bernstein says GOP is enabling Trump as 'mad king',
conservative_filtered_nov19,A Poll was released this morning trying to track trends into 2024 and the majority of deceased voters say they will vote again for Biden.,
politics_filtered_nov20,Science Has Learned So Much About COVID—and the Trump Administration Hasn’t Learned Anything at All,
politics_filtered_nov20,Wisconsin’s Recount Will Only Serve to Confirm Donald Trump’s Humiliating Defeat,
politics_filtered_nov21,Trump's monumental sulk: president retreats from public eye as Covid ravages US,
politics_filtered_nov21,"Yes, Donald Trump claimed fraud after the 2016 Iowa caucuses",
politics_filtered_nov21,"Georgia GOP governor says he understands Trump's frustration, but maintains he's following state laws",
politics_filtered_nov20,"Trump's rhetoric is ""so similar"" to Jim Jones, says woman who fled Jonestown cult",
conservative_filtered_nov19,Obama’s Grotesque Self-Revisionism -- The former president's assessment of Trump ignores his own administration’s lawlessness.,
politics_filtered_nov21,Donald Trump Will Lose One Of His Twitter Accounts To Joe Biden On Inauguration Day. An account the president uses to retweet his conspiracy theories and vitriol will be wiped and handed over to the Biden administration.,
politics_filtered_nov20,Donald Trump is still busy trying to bulldoze democracy,
politics_filtered_nov19,Biden set to meet Friday with top Democratic leaders in Congress,
politics_filtered_nov20,Trump is the true perpetrator of election fraud,
politics_filtered_nov21,"Trump's Michigan election ploy: How it works, and why experts say it will fail",
conservative_filtered_nov20,Biden certified Georgia winner after hand recount,
politics_filtered_nov21,Georgia Secretary of State to certify election for Biden,
politics_filtered_nov20,"Mitt Romney: Trump's efforts to overturn election result are ""undemocratic""",
conservative_filtered_nov20,Democrats And Media Are Reaping Fruit Of 4 Years Of Anti-Trump Conspiracy Theories,
politics_filtered_nov21,"Dear Trump supporters: Those who egg on the president now, given the damage he does to America, are truly reprehensible",
politics_filtered_nov19,Republicans are letting Trump wage war on democracy,
politics_filtered_nov19,Former GSA administrator: 'It's clear' we should recognize Biden as the President-elect,
politics_filtered_nov20,"There is 'no doubt' Joe Biden won Georgia, says Republican Secretary of State Brad Raffensperger",
conservative_filtered_nov20,Trump campaign statement on Georgia,
politics_filtered_nov19,"Fact checking Giuliani and the Trump legal team's wild, fact-free press conference",
conservative_filtered_nov19,"New York City's irrational decision to close NYC schools. They closed schools because a Pretend metric had been reached. You can take your child to a Joe Biden victory street party, but you can’t take them to your local public school to learn.",
politics_filtered_nov20,"Fox's Geraldo Reaches Peak Cult Status, Says Name Vaccine 'The Trump'",
conservative_filtered_nov19,Catholic Archbishop Sends Dire Warning to Trump About the Radical ‘Great Reset’ Movement,
politics_filtered_nov19,Giuliani and fellow Trump lawyers crank out conspiracies as legal challenges implode,
conservative_filtered_nov21,Trump Announces New Regulations Lowering Prescription Drug Costs,
conservative_filtered_nov19,"Facebook's Election Fact Checker Honored Biden In 2017, Employees Donated EXCLUSIVELY to Democrats in 2020",
politics_filtered_nov21,Trump Skips G20 Pandemic Preparedness Meeting as Covid-19 Cases Surpass 12 Million in US,
politics_filtered_nov21,"For Netanyahu and Israel, Trump’s Gifts Kept on Coming. Allowing the convicted spy Jonathan Pollard the ability to emigrate to Israel was just the latest in a long list of prizes for America’s closest ally in the Middle East.",
politics_filtered_nov19,"Prosecutor Resigns from Trump’s Police Commission, Says It Was ‘Smothered by a Pernicious Political Agenda’",
politics_filtered_nov21,How Georgia's pro-Trump election chief became the bane of the GOP,
politics_filtered_nov20,Biden marks Transgender Day of Remembrance,
conservative_filtered_nov19,Biden Coronavirus Task Force’s Osterholm: 'We’re Going to See Hospitals Collapsing in the Next Two to Three Weeks',
politics_filtered_nov20,Mnuchin Denies Trying To Hinder Incoming Biden Administration,
politics_filtered_nov21,Trump tweets undermine Michigan leaders; images show Chatfield drinking at Trump hotel,
politics_filtered_nov21,Michigan attorney general ponders criminal probes of state and local officials who bend to Trump’s will on overturning election results,
politics_filtered_nov21,"Sen. Bernie Sanders: ""Thank God"" Joe Biden won the election",
politics_filtered_nov20,"Georgia secretary of state certifies election results, making Biden's victory official",
politics_filtered_nov20,Trump supporter election lawsuit affidavit seems to mix up Michigan and Minnesota,
politics_filtered_nov21,Trump nominee's long road to Fed may be dead end,
politics_filtered_nov21,Trump Got Tricked by a Twitter Troll Posing as His Sister,
politics_filtered_nov21,Trump accuses Pfizer and Moderna of working to stop his re-election,
politics_filtered_nov20,Trump could be a no-show at virtual G-20 as coronavirus ravages the globe,
conservative_filtered_nov20,Satire: NRA Presents Biden With Prestigious 'Gun Salesman Of The Month' Award,
politics_filtered_nov20,"Ivanka Trump: How Dare You Investigate My Father for Tax Fraud, Which He Definitely Didn’t Use Me to Commit",
conservative_filtered_nov19,"Georgia Sec. of State Makes Bizarre Claim About Trump's Absentee Votes, Which Calls Into Question Other Claims",
politics_filtered_nov19,1 in 10 Go Hungry as Trump and McConnell Fixate on Challenging Election Results,
politics_filtered_nov19,"Trump should quit and 'not be embarrassing', Czech president says.",
politics_filtered_nov20,President Donald Trump’s Election Lawsuits Plagued by Elementary Errors,
politics_filtered_nov20,Georgia certifies Biden’s victory,
conservative_filtered_nov20,'No national shutdown': Joe Biden says shutting down the virus will not require a national lockdown,
politics_filtered_nov20,Biden Be Bold: AOC &amp; Cori Bush Join Climate Protest Outside DNC Urging Activists to “Bring the Heat”,
conservative_filtered_nov20,"Majority of voters say special counsel should be convened to investigate Biden, Ukraine dealings",
politics_filtered_nov21,"Trump Supporters in Georgia Threaten to Destroy GOP, Boycott Runoff Elections",
politics_filtered_nov20,Obama: Navy SEALs Can Drag Trump Out of White House,
politics_filtered_nov19,Trump Invites MI GOP Leaders To White House Amid Desperate Efforts To Overturn Biden Win,
conservative_filtered_nov21,Biden to Impose $200 Gun Tax | Americans for Tax Reform,
politics_filtered_nov20,"Georgia Declares Biden Winner as Election Results Are Certified, Triggering Potential Recount Request From Trump Campaign",
conservative_filtered_nov20,"‘Code Monkey’ and ‘Inventor of Email’, Are Said to Be Assisting Trump in Exposing Dominion Voting Systems",
conservative_filtered_nov20,"Lin Wood loses motion to stop certification, Trump vows to file another ‘major lawsuit’ against Georgia election",
conservative_filtered_nov20,Hoyer on Trump election challenges: 'I think this borders on treason',
conservative_filtered_nov21,Tucker Carlson​ says Trump attorney Sidney Powell wouldn't provide him with any evidence of election fraud. Powell hits back.,
politics_filtered_nov21,Trump playing Golf instead of cooperating to fight the Coronavirus Pandemic,
politics_filtered_nov19,Discussion Thread: President-Elect Joe Biden Gives Remarks After Meeting with Governors,
politics_filtered_nov21,Will Trump Screw Up Republican Efforts to Hang Onto the Senate?,
conservative_filtered_nov20,"When Proven Liars Say Trump's Chances Are Slim, It's Time to Listen to Honest Folk Who Know the Score Instead",
politics_filtered_nov20,Twitter Reminds Matt Gaetz Of ‘Lock Her Up’ After He Slams Calls For Jailing Trump,
politics_filtered_nov21,Steve Mnuchin Is Doing His Part to Sabotage the Biden Administration on His Way out the Door,
politics_filtered_nov21,How Members of Anti-Immigrant Extremist Groups Have Worked Closely with — and Joined — the Trump Administration,
politics_filtered_nov19,"Biden says Trump's refusal to concede is ""incredibly damaging"" and ""totally irresponsible""",
conservative_filtered_nov21,Trump Announces Groundbreaking Rules to Lower Prescription Drug Prices,
politics_filtered_nov19,A Trump speechwriter who was sacked in 2018 for meeting white nationalists has been rehired to oversee US Holocaust memorials,
politics_filtered_nov19,Trump's election power play: Persuade Republican legislators to do what U.S. voters did not,
conservative_filtered_nov20,Trump Lawyer in PA Placed Under Protection After ‘Threats of Harm’,
conservative_filtered_nov19,Butterball Releases Turkey With Biden-Harris Logo So You Can Just Say Your Thanksgiving Gathering Is A Political Rally,
conservative_filtered_nov20,Trump Summons Michigan GOP Leaders for Extraordinary Meeting,
conservative_filtered_nov19,Biden declares there will be 'no national shutdown',
politics_filtered_nov19,Trump Tax Write-Offs Are Ensnared in 2 New York Fraud Investigations,
conservative_filtered_nov21,Trump Leads Voyage Of Pilgrims To Greenland To Establish Even Better America,
politics_filtered_nov20,Democrats demand briefing from GSA chief on delay in ascertaining Biden’s win,
conservative_filtered_nov19,"TRUMP: Biden receives a dump of 143,379 votes at 3:42AM a day after the election",
politics_filtered_nov20,"Georgia to certify Biden's win today, officials say",
politics_filtered_nov19,Second prosecutor resigns from Trump's police commission,
conservative_filtered_nov20,"Biden taps son Hunter as Food Drug Commissioner. “I don’t know about the food part, but my boy knows drugs.""",
conservative_filtered_nov19,"Biden/Harris Would be a Disaster for the Middle East and American Jews. Non-Jews are bewildered by the voting patterns and ideology of American Jews who are predominantly tethered to the Democrat party, do not prioritize Israel as a voting concern, and support actual Jew-haters and Israel-bashers.",
politics_filtered_nov20,Discussion Thread: President Trump Remarks on Prescription Drug Prices - 11/20/2020 | Live - 2:30 pm ET,
conservative_filtered_nov20,Georgia Secretary of State to certify election for Biden,
conservative_filtered_nov19,NRA Presents Biden With Prestigious 'Gun Salesman Of The Month' Award,
conservative_filtered_nov19,Trump Campaign Says It Has Uncovered Enough ‘Fraud’ To Overturn Election Result,
politics_filtered_nov20,Biden Supports Some Student Loan Forgiveness. The Left Is Demanding Much More.,
conservative_filtered_nov21,"'We are a nation of laws, not tweets': Republican Sens. Romney and Sasse decry Trump efforts to challenge election",
politics_filtered_nov19,Trump’s fury grows as US election loss becomes unequivocal,
politics_filtered_nov19,"Biden’s Justice Department should launch sweeping criminal probe into Trump administration, House Democrat says",
politics_filtered_nov20,Trump reportedly told an ally he knows he lost the 2020 election but wants revenge on Democrats for disputing his 2016 win,
politics_filtered_nov21,"Yes, Trump Is (Still) Engaged in an Attempted Coup; and Yes, It Might Lead to a Constitutional Crisis and a Breaking Point",
politics_filtered_nov21,Trump campaign again seeks to stop certification of Pennsylvania's election results,
conservative_filtered_nov19,"Abrams: Trump Needs to Acknowledge 'Legal Sufficiency' of Election, 'As I Did'",
politics_filtered_nov20,Trump strips US Fed of emergency credit powers in latest scorched-earth move,
politics_filtered_nov20,New York Investigations Into Trump Have Reportedly Expanded to Cover Millions in Questionable Tax Write-Offs,
conservative_filtered_nov20,Trump campaign lawyer under protection following ‘threats of harm’,
politics_filtered_nov20,Georgia Secretary of State Certifies Biden’s Win After Audit,
conservative_filtered_nov20,"Biden stuggles with words at press conference -- 'I'm going to ... employ the defense, reconstruct the act'",
politics_filtered_nov21,GOP lawmaker patience runs thin with Trump tactics,
conservative_filtered_nov21,"BLM Co-founder: Biden's election was 'won by Black people', 'We want something for our vote.'",
