title,coding
"Giuliani Presser Was ‘Most Dangerous’ TV In US History, Says Security Expert Trump Fired",
It's Donald Trump vs. democracy. Which side are you on?,
Joe Biden stays silent over proposed meeting with BLM founder,
Donald Trump Called to Support Michigan Canvassing Board Members After Threats,
Biden Coronavirus Task Force’s Osterholm: 'We’re Going to See Hospitals Collapsing in the Next Two to Three Weeks',
Trump personally called two Republicans who now oppose certifying Detroit-area votes,
Lawyer working on Trump Pennsylvania effort placed under official protection due to threats,
"GOP Sens. Romney and Sasse condemn Trump's election challenges, ""We are a nation of laws, not tweets""",
Trump Campaign Lawyers: There Is a Pattern of Planned Voter Fraud in Multiple States,
A new beginning: We will survive our bad breakup with Donald Trump,
'No national shutdown': Joe Biden says shutting down the virus will not require a national lockdown,
‘Blood On His Hands’: Mary Trump Says Her Uncle Must Be ‘Held To Account’ The president’s niece said he is “directly responsible for the deaths of thousands of Americans.,
Trump administration cuts off emergency Federal Reserve programs as coronavirus cases spike,
Trump supporter election lawsuit affidavit seems to mix up Michigan and Minnesota,
"There is 'no doubt' Joe Biden won Georgia, says Republican Secretary of State Brad Raffensperger",
Biden vows there will be no national shutdown,
Joe Biden stays silent over proposed meeting with BLM founder,
"3rd monitor, a Democrat: ""Hundreds of these ballots seemed impeccable, with no folds or creases. The bubble selections were perfectly made ... only observed selections in black ink, and all happened to be selections for Biden.""",
'Climate action is tied to reproductive justice': AOC says the Biden administration has committed to a $2 trillion climate plan,
CNN's Brianna Keilar rolls the tape on Donald Trump's history of baselessly claiming election fraud,
Anti-Trump Legal Team Withdraws In Pennsylvania,
Intimidation Tactics Against Trump Lawyers Undermine Justice,
AZ GOP Chair Dr. Kelli Ward Confident Election ‘Will Ultimately Be Decided in Favor of President Donald J. Trump’,
President Trump invites Michigan GOP leaders to White House,
Edward Norton: Trump 'throwing a wicked pout fest' over election,
Science Has Learned So Much About COVID—and the Trump Administration Hasn’t Learned Anything at All,
Trump's vaccine team will not brief Biden administration: U.S senator,
New York subpoenas Trump Organisation for details of consulting fees paid to Ivanka,
Bigot: Joe Biden Lackey Wanted to Destroy Amy Coney Barrett Because She's Catholic,
"McEnany: Trump's path to victory is Supreme Court, exposing 'systemic' voter fraud",
"Trump's extrajudicial attempt to 'stay in office' would have 'terrified most of the founders,' historian says",
Joe Biden confirmed as winner in Georgia after hand recount results announced,
Nancy Pelosi calls Trump a 'Psychopathic Nut',
Trump Campaign Advisor Boris Epshteyn: Reporters 'Taken Aback' by Evidence Presented By Trump's Lawyers,
Second prosecutor resigns from Trump's police commission,
NY probes President Trump's consulting payments that reduced his taxes,
Cuomo tells Biden $500 billion in stimulus funds needed to bail out states,
"Biden wins Georgia after recount, 'numbers don't lie': Ga. election official",
"Biden taps son Hunter as Food Drug Commissioner. “I don’t know about the food part, but my boy knows drugs.""",
"What has Donald Trump been doing since the US election loss? Tweeting, golfing and watching TV, apparently",
“It’s the Trump Bubble”: The Right Has Created a Wave of COVID Patients Who Don’t Believe It’s Real,
Trump denies Georgia's results after hand recount; prompts concerns over January's Senate runoff,
"Michigan, 6:31 AM, 150,000 votes, 96% for Biden...nothing to see here",
Satire: Biden Getting Excited As Segregation Coming Back Into Style,
"Battered by failures to reverse Biden win, Trump, allies persist with fraud claims",
Trump options narrow as Michigan backs Biden win,
"'We are a nation of laws, not tweets': Republican Sens. Romney and Sasse decry Trump efforts to challenge election",
"Trump Should Quit and 'Not Be Embarrassing,' Says Czech President, Who Was an Early Trump Ally",
"Trump canceled his annual plan to spend Thanksgiving at Mar-a-Lago, as aides describe a 'bunker mentality' at the White House",
"Trump Lawyer Sidney Powell Responds to Tucker Carlson: 'He Was Insulting, Demanding and Rude'",
Obama Tells Jimmy Kimmel: 'We Can Always Send the Navy SEALS' to Remove Trump from White House,
Georgia manual recount confirms Biden victory,
Nancy Pelosi calls Trump a 'psychopathic nut' as the president continues to try to overturn the election results,
Trump objects to counting thousands of Wisconsin ballots,
Tucker Carlson​ says Trump attorney Sidney Powell wouldn't provide him with any evidence of election fraud. Powell hits back.,
Trump Touts New Rules to 'End Global Free Loading' of Prescription Drugs,
"Biden/Harris Would be a Disaster for the Middle East and American Jews. Non-Jews are bewildered by the voting patterns and ideology of American Jews who are predominantly tethered to the Democrat party, do not prioritize Israel as a voting concern, and support actual Jew-haters and Israel-bashers.",
"For Netanyahu and Israel, Trump’s Gifts Kept on Coming. Allowing the convicted spy Jonathan Pollard the ability to emigrate to Israel was just the latest in a long list of prizes for America’s closest ally in the Middle East.",
BLM Thug Who Sucked-Punched Trump Supporter Is a Convicted Child Rapist,
Trump's emotional state is 'quite fragile' after election loss,
Lawyer working on Trump Pennsylvania effort placed under official protection due to threats,
Steve Mnuchin Is Doing His Part to Sabotage the Biden Administration on His Way out the Door,
Report: Biden’s proposed gun control plan could hit gun owners with $34 billion in taxes,
Trump strips US Fed of emergency credit powers in latest scorched-earth move,
Georgia's Republican Secretary of State and his wife received texts telling them they deserve 'to face a firing squad' as Trump escalated his attacks on election results,
Satire: Biden Getting Excited As Segregation Coming Back Into Style,
Committee Chairs Summon GSA Head On Refusal to Grant Biden-Harris Team Access to Transition Resources,
"Shame the Random, Unknown Government Officials Aiding Trump’s Coup Attempt",
Obama Says He Expected Trump Would Only Be One-Term President: 'I Was Right about That',
Trump is trying to overturn an election he didn't win. We didn't get here by accident,
Whoa: Nearly a Third of Democrats Believe the Election Was Stolen From Trump,
"How Christianity Gained Cultural Momentum In The Trump Era -- Some celebrities are not just talking the talk, but they seem to be walking a walk that seems to counter what Hollywood culture promotes and accepts.",
'Keep fighting': Second Trump rally in Washington set to protest electoral college vote,
"Ivanka Trump: How Dare You Investigate My Father for Tax Fraud, Which He Definitely Didn’t Use Me to Commit",
Trump campaign drops Michigan lawsuit: statement,
"Abrams: Trump Needs to Acknowledge 'Legal Sufficiency' of Election, 'As I Did'",
Trump Announces New Regulations Lowering Prescription Drug Costs,
6 Big Claims by Trump’s Lawyers About Overturning Election Results,
AOC to Biden Administration: 'Keep Your Promise' on $2T Green New Deal,
Federal Election Commission Chair: Trump Campaign Has Legitimate Claims of Election Fraud,
Georgia Recount Witnesses Saw Trump Votes Counted for Biden,
Romney: Surprising People Believe Trump's Fraud Claims,
"Romney on Trump election tactics: 'Difficult to imagine a worse, more undemocratic action' by president",
"Sidney Powell: Absent software fraud, Trump 'had at least 80 million votes'",
President-elect Joe Biden Asks Public to Fund Transition as Trump Refuses to Concede,
Donald Trump Called to Support Michigan Canvassing Board Members After Threats,
"As Trump Refuses To Concede, Some South Americans In Houston Are Reminded Of Home",
9 Key Points from Trump Campaign Press Conference on Challenges to Election Results,
Trump voters back the President’s charges of election fraud led by Democrats,
"After Death Threats At Pro-Trump Rally, Milwaukee Health Inspectors Will Get Police Escorts",
Trump Campaign Requests Recount of Key Counties in Wisconsin,
Federal Judge Strikes DOJ from the Docket in E. Jean Carroll’s Case Against Donald Trump,
"Facebook's Election Fact Checker Honored Biden In 2017, Employees Donated EXCLUSIVELY to Democrats in 2020",
Biden Wants Billions in Taxes from Firearms Owners,
Trump lawyer falsely claims voting technology companies were created for changing election results,
"Trump lawyers lay out voter fraud cases in Pennsylvania, Michigan and Wisconsin",
Atlanta Mayor Suggests Trump Would ‘Eat His Own Children’ To Advance Agenda | The Daily Wire,
"Pat Robertson prays for Satan to stop making people believe Joe Biden won the election — “In the name of Jesus, I bind the spirit of delusion that has come across our land... I still think Trump’s gonna ultimately win.”",
[Not Satire] National Democratic Party official suggests re-education for Trump supporters: 'How do you deprogram 75 million people?',
Giuliani: 'Massive Fraud' Used to Steal Election From Trump,
"Georgia election official says hand tally of presidential race is complete, the results affirm Biden’s lead over Trump",
Will Trump Screw Up Republican Efforts to Hang Onto the Senate?,
Trump Got Tricked by a Twitter Troll Posing as His Sister,
"When Proven Liars Say Trump's Chances Are Slim, It's Time to Listen to Honest Folk Who Know the Score Instead",
Biden vows there will be no national shutdown,
Trump accuses Pfizer and Moderna of working to stop his re-election,
"Voice of America's 5 Months Under Trump CEO: Lawsuits, Bias Claims, And A Sex Scandal",
"'We are a nation of laws, not tweets': Republican Sens. Romney and Sasse decry Trump efforts to challenge election",
"Georgia Releases Hand Recount Results, Affirming Biden's Lead",
Fareed Zakaria: Trump presidency is stomping on the face of democracy forever,
New York AG probes consulting payments to Ivanka that reduced Donald Trump's taxes,
"Governors meet with Biden to discuss plan to combat virus — Gov. Larry Hogan, R-Md., was one of a number of governors who met with President-elect Biden on Thursday to talk about combating the coronavirus. Gov. Hogan joins Morning Joe to discuss the meeting.",
Joe Biden Turns 78 and Will Be the Oldest President — After Trump Broke the Record Right Before Him,
Does Trump realize he only has until January 20th 2021 to leave the White House?,
Giuliani and fellow Trump lawyers crank out conspiracies as legal challenges implode,
Trump Is Salting the Soil of American Democracy,
DNC Member Rants: ‘Deprogram’ 75 Million Trump Supporters,
"GOP asks Michigan not to certify election results, citing ‘irregularities’ | The move follows speculation that Trump is seeking to persuade Michigan Republicans to override election results",
Trump Invites MI GOP Leaders To White House Amid Desperate Efforts To Overturn Biden Win,
"Georgia recount confirms Biden victory over Trump, says state election official",
"Joe Biden: Why Are Reporters Asking Me Questions? On Friday, Biden appeared dumbfounded as to why a reporter was asking the projected Democratic presidential-elect a question as the press pool was being scurried away by staff.",
Joe Biden's 'Vote Joe' website defaced by Turkish Hackers,
Harvard Students Demand That Trump Officials Be Preemptively Barred From Campus,
"Whatever Happens In The Next Few Weeks, Brothers and Sisters, Remember This Clip, My Favorite 60 seconds of Trump: 'I am your voice'",
Here’s a Timeline of the Presidential Certification Process That Trump Is Trying to Disrupt,
"Biden stuggles with words at press conference -- 'I'm going to ... employ the defense, reconstruct the act'",
Obama Tells Jimmy Kimmel: 'We Can Always Send the Navy SEALS' to Remove Trump from White House,
"Trump's Michigan election ploy: How it works, and why experts say it will fail",
"Romney on Trump election tactics: 'Difficult to imagine a worse, more undemocratic action' by president",
Tevi Troy: When Senator Biden lectured Israeli Prime Minister Begin over settlements,
"Larry Elder: ""Biden to ‘Racist’ Trump Voters: ‘Let’s Heal’""",
Joe Biden turns 78 today as he’s about to become the oldest sitting president,
'Call His Bluff': Edward Norton's Viral Message On Trump,
Georgia Secretary of State to certify election for Biden,
Biden certified Georgia winner after hand recount,
"If Biden wants unity, he must first hold Trump accountable",
"Rudy Giuliani sweats profusely, falsely accuses Biden of ‘horrible’ crimes during bizarre press conference",
"Kavanaugh should face new investigation, Biden transition official Barbara McQuade wrote",
Trump Announces a Press Conference and a ‘Viable Path to Victory’,
Senators who urged ‘voters to decide’ impeachment won’t admit Trump lost the election,
Berkeley Prof Compares Trump Supporters to Germans Under Nazi Rule and likens coronavirus pandemic to the Holocaust,
Trump Lawyer in PA Placed Under Protection After ‘Threats of Harm’,
Election 2020 updates: Michigan GOP Speaker Chatfield drinks at Trump Hotel; Carson was 'desperately ill' from COVID,
Romney: Surprising People Believe Trump's Fraud Claims,
Bo Erickson of CBS asks Biden about his son. He says it's just a smear campaign.,
Former GSA administrator: 'It's clear' we should recognize Biden as the President-elect,
Trump Campaign Says It Has Uncovered Enough ‘Fraud’ To Overturn Election Result,
"Now 0 for 3 in lawsuits, the Republican Party just will not accept that Trump lost Arizona",
Donald Trump Is Leaving Behind Blueprints to End Democracy,
"Biden taps son Hunter as Food Drug Commissioner. “I don’t know about the food part, but my boy knows drugs.""",
Georgia presidential hand tally finished; affirms Biden's lead over Trump,
Biden certified Georgia winner after hand recount,
"Paris agreement gets 'new lease on life' under Biden, climate advocates say",
Joe Biden Keeps Lead in Georgia After Recount; Giuliani Says Recount ‘Means Nothing’,
Senator Shirkey and Speaker Chatifeld’s names projected on Trump International Hotel,
Opinion | Georgia Certifies: Donald Trump Lost,
Republican Senator Lamar Alexander urges Trump to begin Biden transition,
Trump campaign lawyer under protection following ‘threats of harm’,
NRA Presents Biden With Prestigious 'Gun Salesman Of The Month' Award,
Trump goes golfing in middle of G20 summit,
"Sidney Powell: Absent software fraud, Trump 'had at least 80 million votes'",
Georgia Secretary of State Certifies Biden’s Win After Audit,
Trump to Biden transition must start immediately: Chamber of Commerce,
Trump Fraud Investigations Now Include Tax Write-offs for Ivanka,
Mitt Romney issues scathing statement condemning President Trump's voter fraud claims,
"If Biden Can Take Power by Fraud, Our Republic Has Abolished Itself",
"'We Simply Cannot Afford Half-Measures': Outside DNC, Progressives Demand Biden Go Big for Green New Deal",
Harvard students urge leadership to bar Trump officials from campus,
Hispanic Voters in Florida Feel Election Was Stolen from Trump,
Fox News’ Guy Benson Nails GOP Hypocrisy In Supporting Trump’s Election Denial,
Twitter says it will give @POTUS account to Biden on Inauguration Day,
"New Senate report purportedly 'confirms' Biden family's business ties to Chinese, Russian governments",
Discussion Thread: President Trump Remarks on Prescription Drug Prices - 11/20/2020 | Live - 2:30 pm ET,
Atlanta Mayor Suggests Trump Would ‘Eat His Own Children’ To Advance Agenda | The Daily Wire,
"3rd monitor, a Democrat: ""Hundreds of these ballots seemed impeccable, with no folds or creases. The bubble selections were perfectly made ... only observed selections in black ink, and all happened to be selections for Biden.""",
"Yes, Donald Trump claimed fraud after the 2016 Iowa caucuses",
Trump’s lawsuits plagued by spelling errors: ‘I’ve never seen an election lawyer handle a case as poorly as Giuliani has’,
Obama: Navy SEALs Can Drag Trump Out of White House,
"Embarrassing Lapdog Biden Journalists Debase Their Profession in Latest Presser: ""What did you say to Americans, especially immigrant Americans who came to the United States, looking for political stability and are seeing all the things that the President is doing?""",
"BLM Co-founder: Biden's election was 'won by Black people', 'We want something for our vote.'",
Michigan and Georgia Republicans Just Crushed Trump’s Coup Dreams,
"Michigan, 6:31 AM, 150,000 votes, 96% for Biden...nothing to see here",
Michigan election staff recommend certification of Biden win,
National Democratic Party official suggests re-education for Trump supporters: 'How do you deprogram 75 million people?',
Biden Must Keep His Word and Allow Investigations of Trump to Proceed,
"Lin Wood Savagely Schools Fox News' Dana Perino, Who Suggested Dominion Should Sue Trump's Legal Team",
Biden Be Bold: AOC &amp; Cori Bush Join Climate Protest Outside DNC Urging Activists to “Bring the Heat”,
More GOP Senators Have COVID Than Have Acknowledged That Joe Biden Won,
Butterball Releases Turkey With Biden-Harris Logo So You Can Just Say Your Thanksgiving Gathering Is A Political Rally,
"Catholics sounding alarm about Biden administration, conflicts with moral teachings",
"Biden stuggles with words at press conference -- 'I'm going to ... employ the defense, reconstruct the act'",
"After Insulting Trump Voters For Years, NYT Writer Complains Reaching Out To Them Is A 'Waste Of Time'",
Latinas for Trump founder unseated Florida Democrat after ‘shadow candidate’ with his surname entered the race,
Biden says in video he has created 'voter fraud organization',
National Democratic Party official suggests re-education for Trump supporters: 'How do you deprogram 75 million people?',
Donald Trump Improved Standing With Latinos In 78 Of America’s 100 Majority-Hispanic Counties,
Lin Wood: President Trump won 400 electoral votes | One America News Network,
Trump meets with Michigan GOP leaders in dubious bid to overturn Biden’s election,
"While You Were Focused on The Kraken, the Senate Continued Confirming Trump Federal Judges",
Kayleigh McEnany’s Latest Trump Lie Is Firmly Debunked In Viral Video,
