,Unnamed: 0,coding,group,title,score
200,200,2.0,politics_filtered_nov20,US election 2020: Biden wins Georgia recount as Trump setbacks mount,120
201,201,8.0,politics_filtered_nov21,Biden faces a race against the clock for U.S. to rejoin Iran nuclear deal | KTAB,49
202,202,4.0,politics_filtered_nov21,"After Trump meeting, Michigan GOP lawmakers say they’re not aware of any info that would change Biden’s victory in state",26068
203,203,4.0,conservative_filtered_nov21,Trump Legal Adviser Jenna Ellis Rips Media: ‘You Are Not Unbiased Jurors’,150
204,204,3.0,conservative_filtered_nov19,"Lin Wood loses motion to stop certification, Trump vows to file another ‘major lawsuit’ against Georgia election",86
205,205,4.0,politics_filtered_nov19,‘Dead Man Walking’ nun says Trump administration trying to rush through executions in ‘shameful killing spree’,3505
206,206,5.0,politics_filtered_nov19,Facebook might stop people seeing Trump’s posts in 2021,160
207,207,4.0,politics_filtered_nov20,'Call His Bluff': Edward Norton's Viral Message On Trump,715
208,208,2.0,politics_filtered_nov21,Biden's lead over Trump surpasses 6M votes as more ballots are tallied,16190
209,209,4.0,politics_filtered_nov19,Trump's election lawsuits plagued by elementary errors,185
210,210,4.0,politics_filtered_nov21,Where and why President Trump’s election challenges are falling flat in court: explainer,87
211,211,4.0,politics_filtered_nov19,A hot mess: Rudy Giuliani defends President Trump by attacking Eagles fans while literally melting down on live TV,213
212,212,4.0,politics_filtered_nov19,"AP Explains Calling Arizona For Biden Early, Before It Got Very Close",88
213,213,4.0,politics_filtered_nov20,Trump to Host Michigan Lawmakers Despite Bipartisan Outcry,245
214,214,6.0,conservative_filtered_nov20,Biden declares there will be 'no national shutdown',35
215,215,3.0,politics_filtered_nov19,Trump campaign drops Michigan lawsuit: statement,277
216,216,8.0,politics_filtered_nov21,Biden faces a race against the clock for U.S. to rejoin Iran nuclear deal,51
217,217,2.0,politics_filtered_nov21,Biden's margin of victory over Trump surpasses 6 million votes,18999
218,218,3.0,politics_filtered_nov21,Trump admits Michigan Congressmen met to discuss coup,22083
219,219,7.0,politics_filtered_nov20,New York authorities investigating millions in tax write-offs from the Trump Organization,15249
220,220,4.0,politics_filtered_nov20,"Edward Norton Lays Out Trump's ""Desperate Endgame"" Using Metaphor of Failed Poker Hand — ""The core of it is that he knows he’s in deep, multi-dimensional legal jeopardy and this defines his every action,"" says the actor.",266
221,221,8.0,conservative_filtered_nov19,Senate investigators: New records 'confirm' troubling Biden family links to China and Russia,151
222,222,2.0,politics_filtered_nov19,Georgia presidential hand tally finished; affirms Biden's lead over Trump,50
223,223,3.0,politics_filtered_nov21,"Battered by setbacks in push to reverse Biden win, Trump persists with fraud claims",124
224,224,4.0,politics_filtered_nov20,Trump’s Lawyer Sidney Powell Is Hardcore QAnon: Her performance at Thursday's press conference was virtually a recitation of QAnon’s greatest hits.,2282
225,225,4.0,conservative_filtered_nov19,'They want Kamala in there tomorrow': Limbaugh says Dems to dump Biden -- 'They have no intention of this guy serving a full 4-year term',944
226,226,5.0,politics_filtered_nov19,Texas Republican Rep. Will Hurd shames Trump for firing cybersecurity chief Christopher Krebs,272
227,227,6.0,politics_filtered_nov21,‘My Frustration Turned Into Anger.’ Some Americans Who Lost Family Members to COVID-19 Have Turned Against Donald Trump,228
228,228,4.0,politics_filtered_nov19,"What has Donald Trump been doing since the US election loss? Tweeting, golfing and watching TV, apparently",597
229,229,5.0,politics_filtered_nov20,Joe Biden and Kamala Harris honour the 37 trans Americans murdered this year with vow to end epidemic of violence,231
230,230,7.0,politics_filtered_nov20,NY probes Trump consulting payments that reduced his taxes,1082
231,231,2.0,politics_filtered_nov20,Georgia Secretary of State to certify election for Biden,1382
232,232,4.0,politics_filtered_nov20,"In Georgia, get-out-the-vote operations that helped Biden win haven’t stopped",2556
233,233,2.0,conservative_filtered_nov19,BREAKING: Georgia manual recount confirms Biden victory,58
234,234,5.0,conservative_filtered_nov20,[Not Satire] National Democratic Party official suggests re-education for Trump supporters: 'How do you deprogram 75 million people?',1005
235,235,5.0,politics_filtered_nov21,NAACP Federal Suit: Trump Violated Voting Rights Act,3852
236,236,3.0,politics_filtered_nov20,Trump is trying to overturn an election he didn't win. We didn't get here by accident,54
237,237,2.0,politics_filtered_nov19,Georgia official: Vote audit over; Biden still leads Trump,156
238,238,4.0,politics_filtered_nov21,Biden Must Keep His Word and Allow Investigations of Trump to Proceed,22942
239,239,2.0,politics_filtered_nov21,"After Trump meeting, Michigan GOP leaders say Biden's win still stands",7507
240,240,3.0,politics_filtered_nov19,Trump is trying to stop local officials in key swing states from certifying election results in a last-ditch effort to block Biden,1579
241,241,5.0,politics_filtered_nov21,Merrick Garland is being considered for Attorney General in the Biden administration,499
242,242,1.0,conservative_filtered_nov20,"Kavanaugh should face new investigation, Biden transition official Barbara McQuade wrote",6
243,243,4.0,politics_filtered_nov21,Judge bars Trump appointee from interfering in Voice of America,266
244,244,4.0,politics_filtered_nov20,"Giuliani, Trump Legal Team Melt Down In Insane Presser",4078
245,245,4.0,politics_filtered_nov19,Trump unlikely to get census data in time to exclude undocumented from representation,88
246,246,4.0,conservative_filtered_nov20,About 73% Biden Vote Margin Gain in PA from Areas Given $18 Million by Zuckerberg-Funded ‘Safe Elections’ Project,10
247,247,2.0,conservative_filtered_nov19,Audit Confirms President-Elect Biden Wins State of Georgia.,21
248,248,4.0,conservative_filtered_nov20,Tucker Carlson​ says Trump attorney Sidney Powell wouldn't provide him with any evidence of election fraud. Powell hits back.,83
249,249,4.0,politics_filtered_nov19,‘Blood On His Hands’: Mary Trump Says Her Uncle Must Be ‘Held To Account’ The president’s niece said he is “directly responsible for the deaths of thousands of Americans.,142
250,250,7.0,politics_filtered_nov20,Federal Judge Strikes DOJ from the Docket in E. Jean Carroll’s Case Against Donald Trump,1299
251,251,3.0,conservative_filtered_nov19,"4th witness, also a Democrat saw perfect black marks on a stack of ballots ... 500 in a row all for Biden",334
252,252,5.0,conservative_filtered_nov19,DNC Member Rants: ‘Deprogram’ 75 Million Trump Supporters,58
253,253,4.0,politics_filtered_nov20,Republicans aren't scared of the Trump &amp; Rudy show — they love this stuff. Republicans aren't staying quiet because they fear Trump — this clown-car coup has nothing but upside for them,67
254,254,4.0,politics_filtered_nov21,I met ‘monster’ reality TV star Donald Trump 16 years ago. The reality of him has been monstrous . . .,121
255,255,4.0,politics_filtered_nov21,Trump Owned By Parody Twitter Account He Apparently Believed Was His Sister’s,235
256,256,3.0,politics_filtered_nov19,Biden says Trump challenge to his election victory is 'totally irresponsible',439
257,257,4.0,conservative_filtered_nov20,Butterball Releases Turkey With Biden-Harris Logo So You Can Just Say Your Thanksgiving Gathering Is A Political Rally,119
258,258,5.0,conservative_filtered_nov20,AOC to Biden Administration: 'Keep Your Promise' on $2T Green New Deal,13
259,259,4.0,politics_filtered_nov20,Trump’s lawsuits plagued by spelling errors: ‘I’ve never seen an election lawyer handle a case as poorly as Giuliani has’,20017
260,260,4.0,politics_filtered_nov19,Trump campaign says ‘hackers’ sabotaged livestream to comment on Giuliani hair dye dripping down his face | ‘Unauthorized users’ were heard on the Trump campaign live stream mocking the brown streaks running down Giuliani’s face,297
261,261,3.0,politics_filtered_nov19,Biden team belittles ‘spectacle’ of sweaty Trump lawyer Rudy Giuliani pushing vote fraud conspiracy claims,120
262,262,4.0,conservative_filtered_nov21,"Biden stuggles with words at press conference -- 'I'm going to ... employ the defense, reconstruct the act'",43
263,263,4.0,politics_filtered_nov20,Trump advisers reportedly think Rudy Giuliani is encouraging election lawsuits so he can get paid,5105
264,264,3.0,conservative_filtered_nov19,Trump campaign lawyer under protection following ‘threats of harm’,867
265,265,5.0,politics_filtered_nov20,"Romney on Trump election tactics: 'Difficult to imagine a worse, more undemocratic action' by president",5950
266,266,4.0,conservative_filtered_nov19,Jennifer Dillon crunched the data to s̵t̵e̵e̵r̵ ̵ steal Biden’s success,9
267,267,4.0,conservative_filtered_nov20,Paul Krugman spotted doing a quick economic one-eighty with 'Biden boom' prediction,16
268,268,4.0,conservative_filtered_nov21,Harvard Students Demand That Trump Officials Be Preemptively Barred From Campus,494
269,269,3.0,politics_filtered_nov19,Are you sure Trump's plan to steal the election has failed? You shouldn't be,430
270,270,4.0,conservative_filtered_nov19,Satire: Biden Getting Excited As Segregation Coming Back Into Style,245
271,271,4.0,conservative_filtered_nov19,"Trump Campaign Withdrawing Lawsuit in Michigan After Wayne County ‘Relief,’ Says Giuliani",55
272,272,2.0,politics_filtered_nov19,Georgia recount complete; Biden still the winner,71
273,273,1.0,politics_filtered_nov19,Biden's incoming chief of staff says Trump 'failing to follow the law' by not letting transition begin,90
274,274,3.0,politics_filtered_nov19,Michigan Republicans Are Helping Trump Try to Steal the State’s Election,1318
275,275,5.0,politics_filtered_nov20,Donald Trump Is Leaving Behind Blueprints to End Democracy,1188
276,276,8.0,politics_filtered_nov19,Biden: Trump's actions send 'damaging' message to rest of world,142
277,277,5.0,politics_filtered_nov20,"Biden, top Democrats lay groundwork for multibillion dollar push to boost U.S. broadband",387
278,278,5.0,politics_filtered_nov20,"‘It's difficult to imagine a worse, more undemocratic action by a sitting American President': Mitt Romney rips Trump for his latest efforts to subvert the election",391
279,279,8.0,conservative_filtered_nov19,"Majority of voters say special counsel should be convened to investigate Biden, Ukraine dealings",175
280,280,7.0,politics_filtered_nov20,NY probes President Trump's consulting payments that reduced his taxes,181
281,281,4.0,politics_filtered_nov20,Obama joked that Trump might have to get dragged out of the White House by Navy SEALs if he keeps refusing to concede,12448
282,282,4.0,politics_filtered_nov21,Why Can Trump Try To Steal The Election? Blame The Electoral College.,821
283,283,3.0,conservative_filtered_nov20,Lawyer working on Trump Pennsylvania effort placed under official protection due to threats,481
284,284,4.0,conservative_filtered_nov19,Democrats And Media Are Reaping Fruit Of 4 Years Of Anti-Trump Conspiracy Theories,180
285,285,,conservative_filtered_nov20,Satire: Biden Getting Excited As Segregation Coming Back Into Style,343
286,286,4.0,politics_filtered_nov19,Donald Trump’s Effort To Steal The Election Is Comically Stupid — And Extremely Dangerous,3615
287,287,8.0,conservative_filtered_nov20,"After UN ‘Database’ Targets Israeli Settlements, Trump Administration to Blacklist BDS Supporters",46
288,288,4.0,politics_filtered_nov21,Judge rules against Trump global media chief after firings,91
289,289,4.0,conservative_filtered_nov21,Michigan AG Suggests Criminally Charging Republican Legislators for Meeting With Trump,9
290,290,2.0,politics_filtered_nov19,"Georgia recount complete, and Biden is still the winner",280
291,291,4.0,conservative_filtered_nov19,Trump Admin Brings Hammer Down on 'Anti-Semitic' Movement Targeting Israel,54
292,292,4.0,politics_filtered_nov19,Rudy Giuliani straight-up asked a federal judge to ignore Pennsylvania voters and declare Trump won the state,15068
293,293,4.0,politics_filtered_nov19,Judge Halts Trump Administration’s Eighth Federal Execution,87
294,294,3.0,conservative_filtered_nov19,Giuliani: 'Massive Fraud' Used to Steal Election From Trump,449
295,295,3.0,politics_filtered_nov19,"Trump asks judge to declare him winner in Pennsylvania despite trailing by 80,000 votes",3380
296,296,7.0,politics_filtered_nov20,Trump Fraud Investigations Now Include Tax Write-offs for Ivanka,51238
297,297,3.0,conservative_filtered_nov19,"After Death Threats At Pro-Trump Rally, Milwaukee Health Inspectors Will Get Police Escorts",50
298,298,5.0,conservative_filtered_nov20,Catholic Archbishop Sends Dire Warning to Trump About the Radical ‘Great Reset’ Movement,157
299,299,4.0,politics_filtered_nov20,Trump’s lawyers confused MN and MI vote counts in affidavit intending to prove voter fraud,175
300,300,5.0,politics_filtered_nov20,"If Biden Forgives First $20K of Student Loans, It Erases Debt For 55% of Borrowers",4557
301,301,4.0,politics_filtered_nov19,Trump Is Going Overboard in His Final Days. He Should Just Disappear—Go Golfing and Leave Our Government Alone,1725
302,302,7.0,politics_filtered_nov21,Trump Organization's consulting payments to Ivanka Trump are focus of NY tax probe,19312
303,303,4.0,politics_filtered_nov19,Trump Is Banking on Republican Legislators Ignoring Will of the People. Legal Experts Say It’s ‘Exceedingly Unlikely to Work.’,156
304,304,4.0,politics_filtered_nov21,Trump’s lawsuits plagued by spelling errors: ‘I’ve never seen an election lawyer handle a case as poorly as Giuliani has’,26886
305,305,3.0,politics_filtered_nov19,"Pat Robertson prays for Satan to stop making people believe Joe Biden won the election — “In the name of Jesus, I bind the spirit of delusion that has come across our land... I still think Trump’s gonna ultimately win.”",237
306,306,4.0,conservative_filtered_nov21,6 Big Claims by Trump’s Lawyers About Overturning Election Results,74
307,307,4.0,politics_filtered_nov19,"Biden, Harris to meet with governors, Trump again has no public events",5546
308,308,4.0,politics_filtered_nov21,Senators who urged ‘voters to decide’ impeachment won’t admit Trump lost the election,7110
309,309,4.0,conservative_filtered_nov20,"Trump Campaign Withdrawing Lawsuit in Michigan After Wayne County ‘Relief,’ Says Giuliani",65
310,310,4.0,politics_filtered_nov21,'GOP made a bed of nails': Scaramucci on Republicans appeasing Trump,90
311,311,5.0,politics_filtered_nov20,Republicans Truly Don't Care That Trump Is Undermining Democracy,1761
312,312,4.0,politics_filtered_nov21,White Nationalist Appointed by Trump to Holocaust Commission Praised Jeffrey Epstein for Not Being “a Pussy”,3104
313,313,4.0,politics_filtered_nov20,Trump’s Indifference Amounts to Negligent Homicide,968
314,314,4.0,politics_filtered_nov19,Trump Campaign’s Jenna Ellis Mocked Election Law Expert for Being Right. Then the Trump Campaign Proved Him Right.,175
315,315,8.0,politics_filtered_nov20,Dominion counters Trump legal team after press conference claims: 'No ties to Venezuela or Cuba',61
316,316,4.0,politics_filtered_nov21,The Desperate Final Gasps of Team Trump’s Flailing ‘Mini-Coup’,118
317,317,2.0,conservative_filtered_nov21,Opinion | Georgia Certifies: Donald Trump Lost,13
318,318,4.0,conservative_filtered_nov20,The Hill’s Joe Concha Takes Blowtorch to Pro-Biden ‘Marshmallow Media’,25
319,319,4.0,politics_filtered_nov20,Trump’s fury grows as US election loss becomes unequivocal,2504
320,320,4.0,politics_filtered_nov19,Weissmann: Citizen Trump should be prosecuted for obstructing Special Counsel Mueller,330
321,321,2.0,politics_filtered_nov21,Georgia secretary of state certifies election results that show state’s voters chose Joe Biden for president,2602
322,322,4.0,politics_filtered_nov20,Edward Norton: Trump 'throwing a wicked pout fest' over election,142
323,323,3.0,politics_filtered_nov19,"Rudy Giuliani sweats profusely, falsely accuses Biden of ‘horrible’ crimes during bizarre press conference",773
324,324,4.0,politics_filtered_nov19,"Did Trump drain the swamp? Watchdog gives him an F, while Biden starts with a C",130
325,325,4.0,politics_filtered_nov20,"If Biden Wants to Be Like F.D.R., He Needs the Left | Radical agitation helped bring Social Security and much of the New Deal into being.",452
326,326,5.0,politics_filtered_nov20,"Biden looks to rehire diplomats, others fired by Trump to rebuild State Department",9829
327,327,4.0,conservative_filtered_nov19,Giuliani: Trump Campaign Drops Michigan Lawsuit,34
328,328,4.0,politics_filtered_nov19,Wisconsin Democratic election official: Don't water Trump's 'plant of baloney',716
329,329,5.0,politics_filtered_nov20,"Merrick Garland Among Biden Candidates For Attorney General, Sources Say",5989
330,330,5.0,politics_filtered_nov19,Trump Is Salting the Soil of American Democracy,97
331,331,3.0,politics_filtered_nov19,Trump campaign asks Pennsylvania court to declare Trump winner,3477
332,332,4.0,politics_filtered_nov21,"Let's count the ways Donald Trump has tried to subvert this election, shall we?",2271
333,333,2.0,politics_filtered_nov19,Georgia election official says hand tally of presidential race is complete and results affirm Biden’s lead over Trump,71
334,334,3.0,conservative_filtered_nov19,"Trump lawyers lay out voter fraud cases in Pennsylvania, Michigan and Wisconsin",72
335,335,3.0,politics_filtered_nov21,"Donald Trump says 'I won, by the way' and lashes out at Pfizer claiming it delayed news of the COVID-19 vaccine until after the election",693
336,336,3.0,politics_filtered_nov20,Michigan Senate Leader Shirkey swarmed by activists at airport before flying to meet with Trump,730
337,337,5.0,conservative_filtered_nov19,'We no longer have' an 'honest press' -- Commentator: Media 'casually compares Trump to Hitler' because it's 'what they believe',514
338,338,4.0,politics_filtered_nov20,Bernstein says GOP is enabling Trump as 'mad king',729
339,339,3.0,conservative_filtered_nov19,A Poll was released this morning trying to track trends into 2024 and the majority of deceased voters say they will vote again for Biden.,238
340,340,6.0,politics_filtered_nov20,Science Has Learned So Much About COVID—and the Trump Administration Hasn’t Learned Anything at All,187
341,341,2.0,politics_filtered_nov20,Wisconsin’s Recount Will Only Serve to Confirm Donald Trump’s Humiliating Defeat,262
342,342,6.0,politics_filtered_nov21,Trump's monumental sulk: president retreats from public eye as Covid ravages US,63
343,343,3.0,politics_filtered_nov21,"Yes, Donald Trump claimed fraud after the 2016 Iowa caucuses",2567
344,344,4.0,politics_filtered_nov21,"Georgia GOP governor says he understands Trump's frustration, but maintains he's following state laws",411
345,345,4.0,politics_filtered_nov20,"Trump's rhetoric is ""so similar"" to Jim Jones, says woman who fled Jonestown cult",52004
346,346,4.0,conservative_filtered_nov19,Obama’s Grotesque Self-Revisionism -- The former president's assessment of Trump ignores his own administration’s lawlessness.,295
347,347,1.0,politics_filtered_nov21,Donald Trump Will Lose One Of His Twitter Accounts To Joe Biden On Inauguration Day. An account the president uses to retweet his conspiracy theories and vitriol will be wiped and handed over to the Biden administration.,323
348,348,3.0,politics_filtered_nov20,Donald Trump is still busy trying to bulldoze democracy,129
349,349,5.0,politics_filtered_nov19,Biden set to meet Friday with top Democratic leaders in Congress,143
350,350,3.0,politics_filtered_nov20,Trump is the true perpetrator of election fraud,8627
351,351,4.0,politics_filtered_nov21,"Trump's Michigan election ploy: How it works, and why experts say it will fail",25
352,352,2.0,conservative_filtered_nov20,Biden certified Georgia winner after hand recount,11
353,353,2.0,politics_filtered_nov21,Georgia Secretary of State to certify election for Biden,17509
354,354,5.0,politics_filtered_nov20,"Mitt Romney: Trump's efforts to overturn election result are ""undemocratic""",778
355,355,4.0,conservative_filtered_nov20,Democrats And Media Are Reaping Fruit Of 4 Years Of Anti-Trump Conspiracy Theories,188
356,356,4.0,politics_filtered_nov21,"Dear Trump supporters: Those who egg on the president now, given the damage he does to America, are truly reprehensible",6327
357,357,5.0,politics_filtered_nov19,Republicans are letting Trump wage war on democracy,2213
358,358,4.0,politics_filtered_nov19,Former GSA administrator: 'It's clear' we should recognize Biden as the President-elect,955
359,359,2.0,politics_filtered_nov20,"There is 'no doubt' Joe Biden won Georgia, says Republican Secretary of State Brad Raffensperger",16612
360,360,4.0,conservative_filtered_nov20,Trump campaign statement on Georgia,452
361,361,4.0,politics_filtered_nov19,"Fact checking Giuliani and the Trump legal team's wild, fact-free press conference",266
362,362,6.0,conservative_filtered_nov19,"New York City's irrational decision to close NYC schools. They closed schools because a Pretend metric had been reached. You can take your child to a Joe Biden victory street party, but you can’t take them to your local public school to learn.",689
363,363,4.0,politics_filtered_nov20,"Fox's Geraldo Reaches Peak Cult Status, Says Name Vaccine 'The Trump'",38
364,364,4.0,conservative_filtered_nov19,Catholic Archbishop Sends Dire Warning to Trump About the Radical ‘Great Reset’ Movement,122
365,365,4.0,politics_filtered_nov19,Giuliani and fellow Trump lawyers crank out conspiracies as legal challenges implode,119
366,366,5.0,conservative_filtered_nov21,Trump Announces New Regulations Lowering Prescription Drug Costs,1419
367,367,4.0,conservative_filtered_nov19,"Facebook's Election Fact Checker Honored Biden In 2017, Employees Donated EXCLUSIVELY to Democrats in 2020",420
368,368,6.0,politics_filtered_nov21,Trump Skips G20 Pandemic Preparedness Meeting as Covid-19 Cases Surpass 12 Million in US,274
369,369,8.0,politics_filtered_nov21,"For Netanyahu and Israel, Trump’s Gifts Kept on Coming. Allowing the convicted spy Jonathan Pollard the ability to emigrate to Israel was just the latest in a long list of prizes for America’s closest ally in the Middle East.",72
370,370,3.0,politics_filtered_nov19,"Prosecutor Resigns from Trump’s Police Commission, Says It Was ‘Smothered by a Pernicious Political Agenda’",379
371,371,4.0,politics_filtered_nov21,How Georgia's pro-Trump election chief became the bane of the GOP,122
372,372,5.0,politics_filtered_nov20,Biden marks Transgender Day of Remembrance,717
373,373,6.0,conservative_filtered_nov19,Biden Coronavirus Task Force’s Osterholm: 'We’re Going to See Hospitals Collapsing in the Next Two to Three Weeks',33
374,374,3.0,politics_filtered_nov20,Mnuchin Denies Trying To Hinder Incoming Biden Administration,69
375,375,4.0,politics_filtered_nov21,Trump tweets undermine Michigan leaders; images show Chatfield drinking at Trump hotel,549
376,376,3.0,politics_filtered_nov21,Michigan attorney general ponders criminal probes of state and local officials who bend to Trump’s will on overturning election results,10345
377,377,4.0,politics_filtered_nov21,"Sen. Bernie Sanders: ""Thank God"" Joe Biden won the election",788
378,378,2.0,politics_filtered_nov20,"Georgia secretary of state certifies election results, making Biden's victory official",945
379,379,4.0,politics_filtered_nov20,Trump supporter election lawsuit affidavit seems to mix up Michigan and Minnesota,271
380,380,3.0,politics_filtered_nov21,Trump nominee's long road to Fed may be dead end,59
381,381,4.0,politics_filtered_nov21,Trump Got Tricked by a Twitter Troll Posing as His Sister,680
382,382,3.0,politics_filtered_nov21,Trump accuses Pfizer and Moderna of working to stop his re-election,55296
383,383,6.0,politics_filtered_nov20,Trump could be a no-show at virtual G-20 as coronavirus ravages the globe,145
384,384,5.0,conservative_filtered_nov20,Satire: NRA Presents Biden With Prestigious 'Gun Salesman Of The Month' Award,17
385,385,7.0,politics_filtered_nov20,"Ivanka Trump: How Dare You Investigate My Father for Tax Fraud, Which He Definitely Didn’t Use Me to Commit",704
386,386,3.0,conservative_filtered_nov19,"Georgia Sec. of State Makes Bizarre Claim About Trump's Absentee Votes, Which Calls Into Question Other Claims",18
387,387,3.0,politics_filtered_nov19,1 in 10 Go Hungry as Trump and McConnell Fixate on Challenging Election Results,43027
388,388,8.0,politics_filtered_nov19,"Trump should quit and 'not be embarrassing', Czech president says.",10525
389,389,4.0,politics_filtered_nov20,President Donald Trump’s Election Lawsuits Plagued by Elementary Errors,126
390,390,2.0,politics_filtered_nov20,Georgia certifies Biden’s victory,246
391,391,6.0,conservative_filtered_nov20,'No national shutdown': Joe Biden says shutting down the virus will not require a national lockdown,362
392,392,4.0,politics_filtered_nov20,Biden Be Bold: AOC &amp; Cori Bush Join Climate Protest Outside DNC Urging Activists to “Bring the Heat”,72
393,393,8.0,conservative_filtered_nov20,"Majority of voters say special counsel should be convened to investigate Biden, Ukraine dealings",273
394,394,3.0,politics_filtered_nov21,"Trump Supporters in Georgia Threaten to Destroy GOP, Boycott Runoff Elections",56167
395,395,1.0,politics_filtered_nov20,Obama: Navy SEALs Can Drag Trump Out of White House,1391
