,Unnamed: 0,coding,group,title,score
0,0,3.0,politics_filtered_nov19,Trump campaign dismisses last remaining lawsuit in Michigan as voter fraud claims widely debunked,54050
1,1,4.0,conservative_filtered_nov20,'We no longer have' an 'honest press' -- Commentator: Media 'casually compares Trump to Hitler' because it's 'what they believe',792
2,2,5.0,politics_filtered_nov20,"Trump's extrajudicial attempt to 'stay in office' would have 'terrified most of the founders,' historian says",4574
3,3,2.0,politics_filtered_nov19,Georgia confirms Biden victory and finds no widespread fraud after statewide audit,92
4,4,8.0,politics_filtered_nov20,Supreme Court cancels arguments over Trump bid to withhold parts of Russia probe,450
5,5,3.0,politics_filtered_nov21,Trump tries to drum out GOP election officials who won’t play his games — Georgia Secretary of State Brad Raffensperger's family has received threats and he expects a primary challenge in 2022,1842
6,6,3.0,politics_filtered_nov20,Trump invites Michigan Republican leaders to meet him at White House as he attempts to overturn election results,1171
7,7,6.0,politics_filtered_nov21,Trump tweets about election results and skips session on pandemic during G20,5886
8,8,3.0,politics_filtered_nov20,"Trump lawyers filed a motion in Pennsylvania to clarify they only want to block the state from certifying results of the presidential elections, not any other races on the same ballot",9427
9,9,3.0,politics_filtered_nov20,White House Press Secretary Refuses to Acknowledge Outcome of Election in First Briefing Since Trump Lost,75
10,10,2.0,politics_filtered_nov19,Judge tosses Republican bid to halt Arizona from certifying Biden election win,151
11,11,4.0,politics_filtered_nov19,Donald Trump called Monica Palmer after Wayne County Board of Canvassers meeting,1343
12,12,4.0,politics_filtered_nov19,Trump’s team caught on hot mic discussing Giuliani’s hair dye ‘dripping down his face’,430
13,13,2.0,politics_filtered_nov19,"There is 'no doubt' Joe Biden won Georgia, says Republican Secretary of State Brad Raffensperger",103
14,14,7.0,politics_filtered_nov20,New York subpoenas Trump Organisation for details of consulting fees paid to Ivanka,11073
15,15,2.0,conservative_filtered_nov19,Joe Biden Holds Lead in Georgia After Hand Recount,24
16,16,3.0,politics_filtered_nov20,Trump campaign dismisses last remaining lawsuit in Michigan as voter fraud claims widely debunked,56893
17,17,4.0,politics_filtered_nov20,People who know Rudy Giuliani are shocked by what he’s become. People who know Trump say he’s terrifed,394
18,18,6.0,politics_filtered_nov20,Trump lawyers to avoid Michigan lawmaker meeting after COVID exposure,111
19,19,8.0,politics_filtered_nov19,"Election Loser Trump Should Quit And ‘Not Be Embarrassing’, Czech President Says",521
20,20,4.0,politics_filtered_nov21,Analysis: How Georgia proves Trump has no chance of winning,196
21,21,4.0,politics_filtered_nov19,Trump announces ‘path to victory’ news conference by election legal team,390
22,22,3.0,politics_filtered_nov21,Trump denies Georgia's results after hand recount; prompts concerns over January's Senate runoff,26
23,23,3.0,politics_filtered_nov19,Trump lawyer falsely claims voting technology companies were created for changing election results,103
24,24,5.0,politics_filtered_nov21,Op-Ed: Why Biden should look beyond the usual pool for his Cabinet appointments,36
25,25,7.0,politics_filtered_nov20,Ivanka Trump called the New York investigations into the Trump Organization's finances 'harassment' and motivated by 'rage',230
26,26,4.0,politics_filtered_nov19,Gay Trump supporter loses bid for congress,191
27,27,3.0,politics_filtered_nov21,Judge throws out Trump bid to stop PA vote certification,14
28,28,5.0,politics_filtered_nov21,"What to make of more than 70m Americans who voted for Trump? — As of today, 73,781,603 people voted for Trump, which amounts to 47.2 percent of the total votes counted.",96
29,29,7.0,politics_filtered_nov20,Tucker Carlson: Trump lawyer 'got angry' when pressed for evidence of voter fraud,3629
30,30,4.0,politics_filtered_nov20,Fox News’ Guy Benson Nails GOP Hypocrisy In Supporting Trump’s Election Denial,135
31,31,3.0,politics_filtered_nov20,Michigan Republican leader is meeting with Trump at White House to discuss coup,4605
32,32,3.0,politics_filtered_nov19,"Arizona's secretary of state is the latest election official to receive death threats, and she's ripping Trump and Republican leaders for their baseless claims of fraud",8417
33,33,5.0,politics_filtered_nov19,Americans are dying. Trump is threatening democracy. Where is Mike Pence?,62
34,34,6.0,conservative_filtered_nov19,Biden vows there will be no national shutdown,36
35,35,3.0,politics_filtered_nov19,Federal judge dismisses Trump campaign lawsuit seeking to halt Georgia election certification,87
36,36,8.0,conservative_filtered_nov21,Trump lifts travel ban on Chad,26
37,37,2.0,conservative_filtered_nov19,Georgia Recount Witnesses Saw Trump Votes Counted for Biden,106
38,38,7.0,politics_filtered_nov21,Trump's legal team seemingly didn't notice its allegation of election fraud in Michigan is based on data from Minnesota,12057
39,39,4.0,conservative_filtered_nov19,Trump Announces a Press Conference and a ‘Viable Path to Victory’,161
40,40,2.0,politics_filtered_nov20,"Biden wins Georgia after recount, 'numbers don't lie': Ga. election official",1362
41,41,3.0,politics_filtered_nov21,Michigan Democrats are taking a stand against Trump's campaign to steal the state's vote,338
42,42,5.0,conservative_filtered_nov20,NRA Presents Biden With Prestigious 'Gun Salesman Of The Month' Award,508
43,43,7.0,politics_filtered_nov20,Ivanka Trump calls legal inquiries into Trump business political ‘harassment’ — the president’s daughter was responding to a New York Times report saying investigations now include tax write-offs that appear to involve her,5324
44,44,4.0,conservative_filtered_nov20,Atlanta Mayor Suggests Trump Would ‘Eat His Own Children’ To Advance Agenda,32
45,45,6.0,politics_filtered_nov21,Trump was pictured on his Virginia golf course during a coronavirus meeting for G20 leaders,3199
46,46,4.0,politics_filtered_nov19,Trump Has Abdicated in the Face of Disaster,1696
47,47,4.0,politics_filtered_nov21,Analysis | The Pa. county that explains how Biden won big while other Democrats struggled,33
48,48,3.0,politics_filtered_nov20,"Trump's top aides are 'avoiding' his legal team to distance themselves from his attempt to subvert the election results, report says",390
49,49,6.0,politics_filtered_nov21,'Like Politicizing Toilet Paper': Biden COVID Adviser Slams Politicization of Masks,35
50,50,3.0,politics_filtered_nov21,Trump maintains unproven 'massive' fraud claim after meeting with Michigan lawmakers,103
51,51,5.0,conservative_filtered_nov20,Biden Appoints ‘Anti-Free Speech’ Richard Stengel to Transition Team Media Post,17
52,52,3.0,politics_filtered_nov20,Michigan State senator met by protestors as he arrives for meeting with Trump,393
53,53,4.0,politics_filtered_nov19,"Giuliani, flailing, says Venezuela, Clinton and Soros hatched 'centralized plan' to steal election for Biden",315
54,54,4.0,politics_filtered_nov20,Conservative media has stayed devoted to Trump’s bogus claims of victory — but cracks are starting to show,95
55,55,2.0,politics_filtered_nov20,"Georgia certifies election results, making Biden win official",228
56,56,3.0,conservative_filtered_nov20,Trump campaign lawyer under protection following ‘threats of harm’,876
57,57,3.0,politics_filtered_nov20,Tucker Carlson calls out Trump's election lawyer for refusing to show evidence supporting the president's baseless voter fraud claims,563
58,58,4.0,politics_filtered_nov20,Trump's emotional state is 'quite fragile' after election loss,3194
59,59,5.0,politics_filtered_nov20,Trump Has Appointed 2 White Nationalists To Government Roles Since Losing The Election,2603
60,60,3.0,politics_filtered_nov19,"Pro-Biden Republican group releases video accusing GOP Senator Loeffler of ""craven corruption""",4122
61,61,3.0,politics_filtered_nov20,"GOP Sens. Romney and Sasse condemn Trump's election challenges, ""We are a nation of laws, not tweets""",3333
62,62,,politics_filtered_nov21,"Trump lawyers filed a motion in Pennsylvania to clarify they only want to block the state from certifying results of the presidential elections, not any other races on the same ballot",13699
63,63,5.0,politics_filtered_nov20,House Democrats push Biden to pick Haaland as next Interior secretary,89
64,64,,conservative_filtered_nov20,NRA Presents Biden With Prestigious 'Gun Salesman Of The Month' Award,65
65,65,1.0,politics_filtered_nov19,Trump May Need to Be Impeached and Removed Before Inauguration Day,50247
66,66,6.0,conservative_filtered_nov20,"Biden’s COVID Plan: Close The Economy, Open The Border",27
67,67,3.0,politics_filtered_nov21,"Trump’s Pennsylvania Suit is ‘Incoherent Conspiracy,’ Voters Say",1103
68,68,1.0,politics_filtered_nov21,Twitter to hand over @POTUS account to Biden on January 20,95
69,69,4.0,politics_filtered_nov21,Detroit asks judge to sanction Trump campaign for spreading 'disinformation',7239
70,70,4.0,politics_filtered_nov20,Senate GOP Shatters 123-Year Tradition to Approve Even More Trump Judges,1456
71,71,3.0,politics_filtered_nov20,"As Trump Refuses To Concede, Some South Americans In Houston Are Reminded Of Home",92
72,72,3.0,conservative_filtered_nov21,Watch: Sidney Powell – Millions of DEAD People Voted! 7 Million Votes STOLEN From Trump!,53
73,73,4.0,politics_filtered_nov19,Biden condemns Trump as one of the 'most irresponsible presidents in American history',74
74,74,5.0,conservative_filtered_nov20,Biden Says He Will Admit and Grant Permanent Status to Immigrants Who Go on Food Stamps and Medicaid,81
75,75,1.0,politics_filtered_nov21,President-elect Joe Biden Asks Public to Fund Transition as Trump Refuses to Concede,2057
76,76,3.0,politics_filtered_nov21,Trump’s press secretary Kayleigh McEnany heckled in briefing: ‘When will you admit you lost?’,44623
77,77,2.0,conservative_filtered_nov21,"Georgia certifies election results, making Biden win official",59
78,78,4.0,politics_filtered_nov21,Liz Cheney: Trump should respect ‘the sanctity of our electoral process’,141
79,79,3.0,politics_filtered_nov19,Trump personally called two Republicans who now oppose certifying Detroit-area votes,30035
80,80,,conservative_filtered_nov20,Trump Announces a Press Conference and a ‘Viable Path to Victory’,177
81,81,3.0,politics_filtered_nov21,"Justice Dept. meets Trump, Giuliani vote-fraud claims with silent skepticism",163
82,82,3.0,politics_filtered_nov21,Anger builds in Black community over Trump’s claims of voter fraud in big cities,1847
83,83,5.0,politics_filtered_nov21,Fareed Zakaria: Trump presidency is stomping on the face of democracy forever,663
84,84,4.0,conservative_filtered_nov19,Trump Campaign Holds Press Conference to Outline 'Viable Path to Victory',28
85,85,4.0,conservative_filtered_nov19,Atlanta Mayor Suggests Trump Would ‘Eat His Own Children’ To Advance Agenda | The Daily Wire,34
86,86,5.0,politics_filtered_nov19,"If Biden Forgives First $20K of Student Loans, It Erases Debt For 55% of Borrowers",496
87,87,2.0,politics_filtered_nov20,"Joe Biden wins presidential race in Georgia, defeating Trump.",2816
88,88,5.0,politics_filtered_nov20,Ilhan Omar to President-elect Biden: Seize 'Once-in-a-Generation' Chance to End Disastrous US Foreign Policy,43
89,89,4.0,politics_filtered_nov19,Trump's legal adviser Jenna Ellis in 2016 called him an 'idiot' and said his supporters didn't care about 'facts or logic',11318
90,90,4.0,politics_filtered_nov21,"In 'Tremendous Rebuke' of Trump Appointee, Federal Judge Bars US Media Agency Head From Interfering in News Coverage | ""Michael Pack has repeatedly and intentionally violated the First Amendment rights of VOA journalists.""",846
91,91,4.0,politics_filtered_nov20,"Trump Thought His Secretive Sister Finally Joined MAGA Twitter. So We Called Her. -“I’m trying to delete it,” a woman who identified herself as Trump’s sister said. “I’m just annoyed about this whole thing.”",133
92,92,3.0,politics_filtered_nov20,More GOP Senators Have COVID Than Have Acknowledged That Joe Biden Won,1477
93,93,3.0,conservative_filtered_nov21,Trump Campaign Fact-Checks the Media: Georgia Has Not Certified Biden's Win,77
94,94,7.0,politics_filtered_nov20,"Once Out Of Office, Trump Faces Significant Legal Peril",304
95,95,3.0,conservative_filtered_nov19,"Half of Republicans in new poll say election was 'rigged,' stolen from Trump",1650
96,96,3.0,conservative_filtered_nov21,Joe Biden stays silent over proposed meeting with BLM founder,83
97,97,3.0,conservative_filtered_nov20,A Poll was released this morning trying to track trends into 2024 and the majority of deceased voters say they will vote again for Biden.,265
98,98,3.0,politics_filtered_nov21,"Trump Is Still Raging Against Democracy. But It’s Time To Applaud The Tenacity Of Voters, Poll And USPS Workers",5100
99,99,4.0,conservative_filtered_nov19,Joy Reid vs. Fmr. Trump Aide: How Do You Reconcile Being A Black Man In This Country And A Republican?,17
100,100,5.0,conservative_filtered_nov19,"Biden Hires Pharma, Big Oil People To Fill His Administration After Claiming He Would Be Tough On Those Industries",833
101,101,6.0,politics_filtered_nov21,"After Trump meeting, Michigan GOP lawmakers affirmed Biden will win the state and urged Trump to focus on the COVID-19 pandemic currently ravaging the US",1226
102,102,3.0,politics_filtered_nov20,Joe Scarborough Lays Down Ultimatum To Mitch McConnell Over Trump Support,257
103,103,6.0,politics_filtered_nov19,Health Experts Demand GSA Chief Stop Holding Up Biden’s Transition As COVID Cases Surge,391
104,104,3.0,politics_filtered_nov19,Michigan Republican who balked at certifying election results says Trump called her,3238
105,105,8.0,conservative_filtered_nov21,"New Senate report purportedly 'confirms' Biden family's business ties to Chinese, Russian governments",444
106,106,2.0,politics_filtered_nov20,Joe Biden confirmed as winner in Georgia after hand recount results announced,4230
107,107,3.0,politics_filtered_nov21,Hoyer on Trump election challenges: 'I think this borders on treason',19925
108,108,4.0,conservative_filtered_nov19,The Hill’s Joe Concha Takes Blowtorch to Pro-Biden ‘Marshmallow Media’,17
109,109,4.0,politics_filtered_nov21,"NJ Democrat Calls for Rudy Giuliani, Other Trump Attorneys to be Disbarred",49868
110,110,5.0,politics_filtered_nov21,Trump wanted to bomb Iran — and still could — leaving Biden to pick up the pieces,137
111,111,6.0,conservative_filtered_nov21,Donald Trump: ‘Big Pharma’ Purposely Delayed Coronavirus Vaccine Until After Election,61
112,112,3.0,conservative_filtered_nov20,"If Biden Can Take Power by Fraud, Our Republic Has Abolished Itself",547
113,113,3.0,politics_filtered_nov19,Ernst: Trump lawyer claim that candidates pay to rig elections 'absolutely outrageous',114
114,114,4.0,politics_filtered_nov21,Bernie Sanders says the 'GOP has ceased to be a political party' and 'is now a cult' for staying silent on Trump's election attacks,68201
115,115,2.0,politics_filtered_nov19,Election results: Joe Biden approaches 80 million votes in historic victory,3236
116,116,5.0,politics_filtered_nov21,Trump tells G20 leaders he wants to work with them ‘for a long time’,37
117,117,8.0,politics_filtered_nov19,"Trump Should Quit and 'Not Be Embarrassing,' Says Czech President, Who Was an Early Trump Ally",165
118,118,5.0,politics_filtered_nov21,"Two weeks after Biden named President-elect, Trump faces stinging setbacks",117
119,119,3.0,conservative_filtered_nov20,Giuliani: 'Massive Fraud' Used to Steal Election From Trump,663
120,120,4.0,politics_filtered_nov19,Trump advisers reportedly think Rudy Giuliani is encouraging election lawsuits so he can get paid,663
121,121,2.0,politics_filtered_nov20,Georgia Secretary of State to certify election for Biden,12056
122,122,5.0,politics_filtered_nov21,Biden to Work to End Executions as Government Sets 3 More,239
123,123,3.0,politics_filtered_nov19,Biden nears record 80m votes as Trump persists in trying to overturn result,198
124,124,4.0,politics_filtered_nov19,‘It’s Time for the State Bars to Come Get Their People’: Lawyers Eviscerate Trump Campaign’s ‘Nonsensical’ Press Conference,1125
125,125,4.0,politics_filtered_nov20,Discussion Thread: President-Elect Joe Biden Gives Remarks After Meeting with Governors,4825
126,126,2.0,politics_filtered_nov19,Trump Loses Georgia Again. Audit Confirms President-Elect Joe Biden Wins Goergia.,50
127,127,4.0,politics_filtered_nov21,Judge rules against Trump global media chief after firings,217
128,128,3.0,conservative_filtered_nov20,"3rd monitor, a Democrat: ""Hundreds of these ballots seemed impeccable, with no folds or creases. The bubble selections were perfectly made ... only observed selections in black ink, and all happened to be selections for Biden.""",1530
129,129,5.0,politics_filtered_nov19,"Biden looks to rehire diplomats, others fired by Trump to rebuild State Department",6573
130,130,3.0,conservative_filtered_nov21,Federal Election Commission Chair: Trump Campaign Has Legitimate Claims of Election Fraud,0
131,131,5.0,politics_filtered_nov21,"After Years of Watching ‘Trump Show,’ TV News Starts to Turn it Off",2486
132,132,5.0,politics_filtered_nov20,Don't ignore Trump's election mischief. Take it seriously,465
133,133,1.0,conservative_filtered_nov20,Obama Tells Jimmy Kimmel: 'We Can Always Send the Navy SEALS' to Remove Trump from White House,100
134,134,5.0,politics_filtered_nov19,"Trump will lose his 'world leader' Twitter privileges on January 20, Jack Dorsey confirms — meaning he could get banned just like everyone else",23838
135,135,4.0,politics_filtered_nov21,Judge rules against Trump global media chief after firings,128
136,136,4.0,conservative_filtered_nov19,"When Proven Liars Say Trump's Chances Are Slim, It's Time to Listen to Honest Folk Who Know the Score Instead",26
137,137,3.0,conservative_filtered_nov21,Biden says in video he has created 'voter fraud organization',28
138,138,4.0,politics_filtered_nov21,Latinas for Trump founder unseated Florida Democrat after seeing ‘shadow candidate’ enter race,207
139,139,4.0,politics_filtered_nov19,Calls for Trump ally Lindsey Graham to resign over Georgia phone call,68968
140,140,3.0,politics_filtered_nov19,Trump campaign is 1-29 in post-election lawsuits after latest defeat,488
141,141,4.0,politics_filtered_nov19,"'People Need Help': AOC Slams Trump's Economic Adviser for Saying Stimulus Not Needed, Economy's Doing Fine",4442
142,142,1.0,politics_filtered_nov19,Does Trump realize he only has until January 20th 2021 to leave the White House?,84
143,143,4.0,politics_filtered_nov19,A new #Resistance hero emerges amid the Trump endgame: The dutiful civil servant,3322
144,144,1.0,conservative_filtered_nov21,Twitter Plans To Hand @POTUS Handle Over To Biden On Jan. 20 No Matter What,8
145,145,3.0,politics_filtered_nov19,Giuliani Alleges a Vast International Conspiracy to Steal the Election From Trump,132
146,146,3.0,politics_filtered_nov21,Wisconsin officials: Trump observers obstructing recount,1313
147,147,3.0,politics_filtered_nov21,"Analysis: With silence, GOP enables Trump's risky endgame",130
148,148,4.0,politics_filtered_nov21,AP Fact Check: Trump's flailing effort resting on mendacity,108
149,149,5.0,conservative_filtered_nov19,Biden Wants Billions in Taxes from Firearms Owners,17
150,150,4.0,politics_filtered_nov21,GOP Michigan ex-governor says state board will certify Biden winner over 'bully' Trump,1732
151,151,2.0,politics_filtered_nov19,"Trump faces likely setback in Georgia recount, drops Michigan lawsuit",131
152,152,4.0,politics_filtered_nov21,"Joe Biden Owes His Victory to the Left. Organizers, not consultants, delivered key states like Pennsylvania, Arizona and Georgia.",3581
153,153,4.0,politics_filtered_nov20,"Biden brushes aside Trump attempts to overturn the election, confident his victory will stand",92
154,154,3.0,politics_filtered_nov21,Nancy Pelosi calls Trump a 'psychopathic nut' as the president continues to try to overturn the election results,14572
155,155,3.0,conservative_filtered_nov20,Trump Campaign Fact-Checks the Media: Georgia Has Not Certified Biden's Win,37
156,156,4.0,politics_filtered_nov19,Trump is trying to disenfranchise Black voters. The GOP isn’t stopping him.,389
157,157,6.0,conservative_filtered_nov20,Biden Says He Discussed National Mask Mandate With Governors During Meeting,0
158,158,3.0,conservative_filtered_nov21,"McEnany: Trump's path to victory is Supreme Court, exposing 'systemic' voter fraud",50
159,159,3.0,conservative_filtered_nov21,Trump Objects to Counting Thousands of Wisconsin Ballots,8
160,160,1.0,politics_filtered_nov21,Obama jokes that Navy SEALs could remove Trump from the White House,228
161,161,4.0,politics_filtered_nov20,"Happy birthday, Joe: 78-year-old Biden to be oldest US president to take office",328
162,162,3.0,politics_filtered_nov20,Bob Corker: Republicans ‘have an obligation’ to challenge Trump’s voter fraud allegations,496
163,163,3.0,conservative_filtered_nov20,"TRUMP: Biden receives a dump of 143,379 votes at 3:42AM a day after the election",1978
164,164,4.0,politics_filtered_nov19,"Trump canceled his annual plan to spend Thanksgiving at Mar-a-Lago, as aides describe a 'bunker mentality' at the White House",7893
165,165,4.0,politics_filtered_nov19,Biden Urged to Make Haaland First Native American in Cabinet,110
166,166,3.0,politics_filtered_nov19,Trump Tries Desperate And Damaging New Tack As He Refuses To Accept Loss,967
167,167,8.0,conservative_filtered_nov19,Tevi Troy: When Senator Biden lectured Israeli Prime Minister Begin over settlements,1
168,168,4.0,politics_filtered_nov21,Trump Takes Another L: Michigan GOPers Say No To Election Steal,7115
169,169,4.0,politics_filtered_nov21,Election 2020 updates: Michigan GOP Speaker Chatfield drinks at Trump Hotel; Carson was 'desperately ill' from COVID,58
170,170,3.0,politics_filtered_nov20,‘Undemocratic’: Romney Rebukes Trump Effort To Overturn Will Of Michigan Voters,118
171,171,4.0,politics_filtered_nov20,'Integrity matters': Meet the lone Republican election official standing up to his party and Trump,13514
172,172,3.0,politics_filtered_nov19,Trump’s Campaign Dropped Another Lawsuit And Lied About Stopping Detroit From Certifying Votes,152
173,173,8.0,politics_filtered_nov20,Business Leaders to Trump: Give It Up,200
174,174,4.0,politics_filtered_nov19,This Is the Most Pathetic Trump Fundraising Email Yet,377
175,175,4.0,politics_filtered_nov20,Apparently Not Even Jared and Ivanka Think Trump's Election Scam Is Going Anywhere,174
176,176,5.0,conservative_filtered_nov20,Biden Deputy Chief of Staff Pushed 'Mandatory' Firearm Buybacks,25
177,177,3.0,politics_filtered_nov20,Trump to meet Michigan lawmakers in bid to overturn electoral defeat,164
178,178,2.0,conservative_filtered_nov21,Donald Trump Improved Standing With Latinos In 78 Of America’s 100 Majority-Hispanic Counties,142
179,179,4.0,politics_filtered_nov21,Kayleigh McEnany’s Latest Trump Lie Is Firmly Debunked In Viral Video,7534
180,180,3.0,politics_filtered_nov20,Trump's legal team seemingly didn't notice its allegation of election fraud in Michigan is based on data from Minnesota,876
181,181,4.0,politics_filtered_nov19,Republicans Confirm Another One Of Trump's Unqualified Court Picks,374
182,182,5.0,politics_filtered_nov21,The Danger (and Ineptitude) of Trump’s Failed Coup,558
183,183,4.0,politics_filtered_nov19,YouTube Is Cashing In on Trump's Election Conspiracy During Giuliani Livestream,235
184,184,3.0,politics_filtered_nov19,Trump called Michigan Republicans before they sought to rescind their certification of votes,625
185,185,4.0,politics_filtered_nov19,Obama says Republicans officials going along with Trump's unfounded claims because they're 'intimidated',333
186,186,4.0,politics_filtered_nov20,Nancy Pelosi calls Trump a 'psychopathic nut' as the president continues to try to overturn the election results,261
187,187,5.0,conservative_filtered_nov21,National Democratic Party official suggests re-education for Trump supporters: 'How do you deprogram 75 million people?',57
188,188,2.0,conservative_filtered_nov20,BREAKING: Georgia manual recount confirms Biden victory,22263
189,189,4.0,conservative_filtered_nov19,Romney: Surprising People Believe Trump's Fraud Claims,179
190,190,3.0,conservative_filtered_nov19,9 Key Points from Trump Campaign Press Conference on Challenges to Election Results,91
191,191,3.0,politics_filtered_nov21,Trump skips G20 coronavirus meeting to play golf and tweet bogus election claims,492
192,192,7.0,politics_filtered_nov21,"Voice of America's 5 Months Under Trump CEO: Lawsuits, Bias Claims, And A Sex Scandal",390
193,193,4.0,politics_filtered_nov19,Atlanta mayor: Trump would 'eat his own children' if it helped him,956
194,194,1.0,politics_filtered_nov21,Twitter will give @POTUS handle to Joe Biden on Inauguration Day,329
195,195,4.0,conservative_filtered_nov20,Trump Campaign Advisor Boris Epshteyn: Reporters 'Taken Aback' by Evidence Presented By Trump's Lawyers,91
196,196,4.0,politics_filtered_nov20,"House Democrats tell GSA chief her refusal to certify Biden's win is ""having grave effects""",827
197,197,3.0,conservative_filtered_nov19,"Can We Say Again? Third County in Georgia Finds More Missing Votes, Most for Trump",1870
198,198,1.0,conservative_filtered_nov21,Obama Tells Jimmy Kimmel: 'We Can Always Send the Navy SEALS' to Remove Trump from White House,222
199,199,4.0,politics_filtered_nov21,"Meet Pennsylvania’s anger translator, and Donald Trump’s worst nightmare",11505
