,Unnamed: 0,coding,group,title,score
396,396,3.0,politics_filtered_nov19,Trump Invites MI GOP Leaders To White House Amid Desperate Efforts To Overturn Biden Win,930
397,397,5.0,conservative_filtered_nov21,Biden to Impose $200 Gun Tax | Americans for Tax Reform,20
398,398,2.0,politics_filtered_nov20,"Georgia Declares Biden Winner as Election Results Are Certified, Triggering Potential Recount Request From Trump Campaign",115
399,399,4.0,conservative_filtered_nov20,"‘Code Monkey’ and ‘Inventor of Email’, Are Said to Be Assisting Trump in Exposing Dominion Voting Systems",7
400,400,3.0,conservative_filtered_nov20,"Lin Wood loses motion to stop certification, Trump vows to file another ‘major lawsuit’ against Georgia election",259
401,401,3.0,conservative_filtered_nov20,Hoyer on Trump election challenges: 'I think this borders on treason',9
402,402,4.0,conservative_filtered_nov21,Tucker Carlson​ says Trump attorney Sidney Powell wouldn't provide him with any evidence of election fraud. Powell hits back.,163
403,403,6.0,politics_filtered_nov21,Trump playing Golf instead of cooperating to fight the Coronavirus Pandemic,28
404,404,4.0,politics_filtered_nov19,Discussion Thread: President-Elect Joe Biden Gives Remarks After Meeting with Governors,2593
405,405,5.0,politics_filtered_nov21,Will Trump Screw Up Republican Efforts to Hang Onto the Senate?,1094
406,406,4.0,conservative_filtered_nov20,"When Proven Liars Say Trump's Chances Are Slim, It's Time to Listen to Honest Folk Who Know the Score Instead",75
407,407,4.0,politics_filtered_nov20,Twitter Reminds Matt Gaetz Of ‘Lock Her Up’ After He Slams Calls For Jailing Trump,2857
408,408,1.0,politics_filtered_nov21,Steve Mnuchin Is Doing His Part to Sabotage the Biden Administration on His Way out the Door,3174
409,409,4.0,politics_filtered_nov21,How Members of Anti-Immigrant Extremist Groups Have Worked Closely with — and Joined — the Trump Administration,115
410,410,5.0,politics_filtered_nov19,"Biden says Trump's refusal to concede is ""incredibly damaging"" and ""totally irresponsible""",213
411,411,5.0,conservative_filtered_nov21,Trump Announces Groundbreaking Rules to Lower Prescription Drug Prices,687
412,412,5.0,politics_filtered_nov19,A Trump speechwriter who was sacked in 2018 for meeting white nationalists has been rehired to oversee US Holocaust memorials,16594
413,413,4.0,politics_filtered_nov19,Trump's election power play: Persuade Republican legislators to do what U.S. voters did not,302
414,414,3.0,conservative_filtered_nov20,Trump Lawyer in PA Placed Under Protection After ‘Threats of Harm’,81
415,415,4.0,conservative_filtered_nov19,Butterball Releases Turkey With Biden-Harris Logo So You Can Just Say Your Thanksgiving Gathering Is A Political Rally,47
416,416,4.0,conservative_filtered_nov20,Trump Summons Michigan GOP Leaders for Extraordinary Meeting,26
417,417,6.0,conservative_filtered_nov19,Biden declares there will be 'no national shutdown',26
418,418,7.0,politics_filtered_nov19,Trump Tax Write-Offs Are Ensnared in 2 New York Fraud Investigations,50
419,419,4.0,conservative_filtered_nov21,Trump Leads Voyage Of Pilgrims To Greenland To Establish Even Better America,64
420,420,3.0,politics_filtered_nov20,Democrats demand briefing from GSA chief on delay in ascertaining Biden’s win,1340
421,421,4.0,conservative_filtered_nov19,"TRUMP: Biden receives a dump of 143,379 votes at 3:42AM a day after the election",1965
422,422,2.0,politics_filtered_nov20,"Georgia to certify Biden's win today, officials say",704
423,423,5.0,politics_filtered_nov19,Second prosecutor resigns from Trump's police commission,640
424,424,5.0,conservative_filtered_nov20,"Biden taps son Hunter as Food Drug Commissioner. “I don’t know about the food part, but my boy knows drugs.""",2557
425,425,8.0,conservative_filtered_nov19,"Biden/Harris Would be a Disaster for the Middle East and American Jews. Non-Jews are bewildered by the voting patterns and ideology of American Jews who are predominantly tethered to the Democrat party, do not prioritize Israel as a voting concern, and support actual Jew-haters and Israel-bashers.",227
426,426,4.0,politics_filtered_nov20,Discussion Thread: President Trump Remarks on Prescription Drug Prices - 11/20/2020 | Live - 2:30 pm ET,1
427,427,2.0,conservative_filtered_nov20,Georgia Secretary of State to certify election for Biden,25
428,428,5.0,conservative_filtered_nov19,NRA Presents Biden With Prestigious 'Gun Salesman Of The Month' Award,82
429,429,3.0,conservative_filtered_nov19,Trump Campaign Says It Has Uncovered Enough ‘Fraud’ To Overturn Election Result,632
430,430,5.0,politics_filtered_nov20,Biden Supports Some Student Loan Forgiveness. The Left Is Demanding Much More.,94
431,431,5.0,conservative_filtered_nov21,"'We are a nation of laws, not tweets': Republican Sens. Romney and Sasse decry Trump efforts to challenge election",63
432,432,4.0,politics_filtered_nov19,Trump’s fury grows as US election loss becomes unequivocal,467
433,433,7.0,politics_filtered_nov19,"Biden’s Justice Department should launch sweeping criminal probe into Trump administration, House Democrat says",17336
434,434,4.0,politics_filtered_nov20,Trump reportedly told an ally he knows he lost the 2020 election but wants revenge on Democrats for disputing his 2016 win,9756
435,435,3.0,politics_filtered_nov21,"Yes, Trump Is (Still) Engaged in an Attempted Coup; and Yes, It Might Lead to a Constitutional Crisis and a Breaking Point",1123
436,436,2.0,politics_filtered_nov21,Trump campaign again seeks to stop certification of Pennsylvania's election results,75
437,437,4.0,conservative_filtered_nov19,"Abrams: Trump Needs to Acknowledge 'Legal Sufficiency' of Election, 'As I Did'",53
438,438,3.0,politics_filtered_nov20,Trump strips US Fed of emergency credit powers in latest scorched-earth move,623
439,439,7.0,politics_filtered_nov20,New York Investigations Into Trump Have Reportedly Expanded to Cover Millions in Questionable Tax Write-Offs,1260
440,440,3.0,conservative_filtered_nov20,Trump campaign lawyer under protection following ‘threats of harm’,241
441,441,2.0,politics_filtered_nov20,Georgia Secretary of State Certifies Biden’s Win After Audit,1817
442,442,4.0,conservative_filtered_nov20,"Biden stuggles with words at press conference -- 'I'm going to ... employ the defense, reconstruct the act'",19
443,443,4.0,politics_filtered_nov21,GOP lawmaker patience runs thin with Trump tactics,430
444,444,5.0,conservative_filtered_nov21,"BLM Co-founder: Biden's election was 'won by Black people', 'We want something for our vote.'",58
445,445,8.0,politics_filtered_nov19,"'Up is down, down is up': Trump did Russia's job for it by firing Chris Krebs, and Krebs' removal is the biggest sign of his success",511
446,446,4.0,politics_filtered_nov20,An anonymous group of top US CEOs said they would hold off acting against Trump until after the Georgia recount. It's done.,9733
447,447,5.0,politics_filtered_nov21,"The Perils of Not Prosecuting Trump Joe Biden is wary of a legal reckoning against his predecessor, but to let Trump go would be to sanction future corruption.",4683
448,448,4.0,conservative_filtered_nov21,Anti-Trump Legal Team Withdraws In Pennsylvania,1048
449,449,3.0,conservative_filtered_nov19,Trump Campaign Lawyers: There Is a Pattern of Planned Voter Fraud in Multiple States,13
450,450,4.0,politics_filtered_nov19,'Integrity matters': Meet the lone Republican election official standing up to his party and Trump,11552
451,451,6.0,politics_filtered_nov19,Trump team admits to keeping Biden officials in dark over Covid vaccine plan,604
452,452,4.0,conservative_filtered_nov19,Former US president Donald Trump campaign drops Michigan lawsuit,10
453,453,4.0,conservative_filtered_nov21,"Whatever Happens In The Next Few Weeks, Brothers and Sisters, Remember This Clip, My Favorite 60 seconds of Trump: 'I am your voice'",49
454,454,7.0,politics_filtered_nov21,Opinion: Hold President Trump accountable for his misdeeds,1919
455,455,2.0,politics_filtered_nov19,Biden vote tally getting close to 80 million,2365
456,456,4.0,politics_filtered_nov21,Trump goes golfing in middle of G20 summit,241
457,457,4.0,politics_filtered_nov21,No Take Backs! Blackburn Spox Says GOPer Didn’t Mean To Call Biden President-Elect,155
458,458,3.0,conservative_filtered_nov20,"After Death Threats At Pro-Trump Rally, Milwaukee Health Inspectors Will Get Police Escorts",77
459,459,3.0,politics_filtered_nov21,Letters to the Editor: Stop Donald Trump's coup. Impeach him again,3860
460,460,3.0,politics_filtered_nov21,"Trump forges ahead with frantic effort to overturn election | Having exhausted many of his legal options, Trump is looking at other ways to subvert Joe Biden’s victory.",18
461,461,3.0,politics_filtered_nov21,Wisconsin officials: Trump observers obstructing recount,586
462,462,5.0,politics_filtered_nov21,Joe Biden Turns 78 and Will Be the Oldest President — After Trump Broke the Record Right Before Him,125
463,463,4.0,conservative_filtered_nov20,Satire: Obama Horrified As Trump Undoes His Years Of Hard Work Bombing The Middle East,1270
464,464,6.0,conservative_filtered_nov19,"NYT Columnist Admits ‘Trump Was Right,’ Dems ‘Wrong’ On Crucial COVID Policy | The Daily Wire",27
465,465,1.0,politics_filtered_nov20,"Kavanaugh should face new investigation, Biden transition official Barbara McQuade wrote",399
466,466,5.0,politics_filtered_nov19,"Biden's top unification task: Expose Trump team wrongdoing, restore trust in government - Biden needs a government-wide audit to find every ounce of Trump administration mismanagement and corruption. Unity hinges on transparency and trust.",13153
467,467,4.0,conservative_filtered_nov19,BLM Thug Who Sucked-Punched Trump Supporter Is a Convicted Child Rapist,3613
468,468,5.0,politics_filtered_nov19,Biden to name Treasury nominee ‘acceptable to all elements of the party’ around Thanksgiving,93
469,469,5.0,politics_filtered_nov21,Trump appointed judges in Florida overturn ban on conversion therapy for minors,451
470,470,4.0,politics_filtered_nov19,"Giuliani Presser Was ‘Most Dangerous’ TV In US History, Says Security Expert Trump Fired",1193
471,471,3.0,conservative_filtered_nov20,"'We are a nation of laws, not tweets': Republican Sens. Romney and Sasse decry Trump efforts to challenge election",38
472,472,6.0,politics_filtered_nov19,“It’s the Trump Bubble”: The Right Has Created a Wave of COVID Patients Who Don’t Believe It’s Real,390
473,473,3.0,conservative_filtered_nov21,"Georgia Gov. Kemp Calls for Audit, Says Trump Can Demand New Recount",68
474,474,4.0,politics_filtered_nov21,Trump has longstanding history of calling elections 'rigged' if he doesn’t like the results,3459
475,475,4.0,conservative_filtered_nov21,"Rudy and Sidney’s Krakentastic Spectacle, and What It Could Mean -- A dismissive legacy media might have panned Team Trump’s press conference Thursday, but it was a significant moment with significant portents.",73
476,476,5.0,politics_filtered_nov20,"Mitt Romney on Trump: ‘It is difficult to imagine a worse, more undemocratic action by a sitting American President’",2012
477,477,5.0,politics_filtered_nov20,"Trump Is Rushing Through His Biggest, Most Dangerous Arms Deal. Congress Could Stop It.",688
478,478,2.0,conservative_filtered_nov20,"Michigan, 6:31 AM, 150,000 votes, 96% for Biden...nothing to see here",919
479,479,2.0,conservative_filtered_nov21,Biden certified Georgia winner after hand recount,38
480,480,4.0,politics_filtered_nov20,"No, You Do Not Have to Feel the Trump Voter's Pain — There is no reason, after five and half years of untruths, dog-whistles, slurs and conspiracies, and weeks of Trump trying to undermine Biden’s win, to hug the people who want to disenfranchise you.",7817
481,481,5.0,politics_filtered_nov21,Cuomo tells Biden $500 billion in stimulus funds needed to bail out states,231
482,482,4.0,conservative_filtered_nov20,"While You Were Focused on The Kraken, the Senate Continued Confirming Trump Federal Judges",569
483,483,5.0,politics_filtered_nov19,"'We Simply Cannot Afford Half-Measures': Outside DNC, Progressives Demand Biden Go Big for Green New Deal",62
484,484,4.0,politics_filtered_nov21,"Rudy Giuliani's quixotic frenzy has observers wondering if he may need Trump's protection | ""One explanation? He needs a pardon and he's trying to earn it,"" a CNN analyst says",12418
485,485,4.0,conservative_filtered_nov21,Biden Mocks a Reporter for Asking a Question as Biden's Staff Tries to Get the Press Out of There,49
486,486,2.0,politics_filtered_nov20,Georgia certifies that Joe Biden won the recount,1160
487,487,4.0,conservative_filtered_nov21,"Joe Biden: Why Are Reporters Asking Me Questions? On Friday, Biden appeared dumbfounded as to why a reporter was asking the projected Democratic presidential-elect a question as the press pool was being scurried away by staff.",173
488,488,3.0,politics_filtered_nov21,Wisconsin officials: Trump observers obstructing recount,166
489,489,3.0,politics_filtered_nov19,An unusually easy Trump debunking: There was no suspicious vote dump in Wisconsin,623
490,490,1.0,politics_filtered_nov19,Why Trump Should Not Have Access to U.S. Intelligence After January 20,12864
491,491,1.0,politics_filtered_nov19,Republican-leaning U.S. Chamber of Commerce urges Trump to stop delaying transition to Biden administration,519
492,492,5.0,politics_filtered_nov21,'A Disgrace': Trump's DOJ Schedules Three More Federal Executions in Days Before Anti-Death Penalty Biden Takes Office,94
493,493,6.0,politics_filtered_nov21,"Trump addresses virtual G-20 summit, heads out before session on pandemic",67
494,494,4.0,conservative_filtered_nov21,"LIVE: March for Trump in Atlanta, Georgia",218
495,495,3.0,politics_filtered_nov20,Trump meets with Michigan GOP leaders in dubious bid to overturn Biden’s election,38
496,496,4.0,politics_filtered_nov21,Trump refuses to take questions after falsely claiming he won election in first media appearance in weeks. No sitting US president has falsely claimed an election victory from the Brady Briefing Room. Until Friday,18479
497,497,3.0,politics_filtered_nov19,Trump is the true perpetrator of election fraud,911
498,498,4.0,politics_filtered_nov19,Census Officials Say They Can’t Meet Trump’s Deadline for Population Count | Officials have concluded the Census Bureau won’t have data on time to carry out the administration’s goal of stripping unauthorized immigrants from population totals for apportionment.,586
499,499,5.0,conservative_filtered_nov19,"Biden taps son Hunter as Food Drug Commissioner. “I don’t know about the food part, but my boy knows drugs.""",2561
500,500,3.0,politics_filtered_nov19,'It was not pressure': Trump called a Michigan county official who now says she wants to rescind her vote to certify the election,2463
501,501,2.0,politics_filtered_nov19,"Georgia election official says hand tally of presidential race is complete, the results affirm Biden’s lead over Trump",1744
502,502,3.0,conservative_filtered_nov21,Gregg Jarrett Has an Important Reminder for the Media About the Trump Campaign's Evidence of Voter Fraud,19
503,503,3.0,politics_filtered_nov19,Trump and allies have sought to exclude 1 of every 10 votes in key states,382
504,504,3.0,politics_filtered_nov20,Sen. Lamar Alexander says no evidence of voter fraud: Biden should receive briefings,863
505,505,3.0,politics_filtered_nov21,"Shame the Random, Unknown Government Officials Aiding Trump’s Coup Attempt",5509
506,506,1.0,politics_filtered_nov20,Top House Democrats Demand Biden Transition Briefing From GSA Chief,278
507,507,4.0,politics_filtered_nov20,"There's 'not a legal' or political path for Trump to remain in office, says Gore recount lawyer",9149
508,508,3.0,politics_filtered_nov21,Wisconsin Officials: Trump Observers Obstructing Recount,56
509,509,4.0,politics_filtered_nov20,"As Trump gets more brazen about trying to steal the election, can congressional Republicans ditch him?",60
510,510,3.0,politics_filtered_nov21,Ivanka Trump distances self from dad’s election fraud claims as her own legal jeopardy grows,9876
511,511,5.0,politics_filtered_nov20,Romney says he can't imagine 'a more undemocratic action' than what Trump's done,457
512,512,6.0,politics_filtered_nov20,Trump trade advisor makes wild claim China sent ‘thousands of people around the world’ to spread Covid,43
513,513,4.0,politics_filtered_nov21,Michigan and Georgia Republicans Just Crushed Trump’s Coup Dreams,11395
514,514,2.0,politics_filtered_nov20,Georgia confirms a Biden win while Trump targets Michigan,287
515,515,5.0,conservative_filtered_nov19,Here's How Much Biden's Gun Tax Could Cost Every Day Americans,10
516,516,3.0,conservative_filtered_nov21,Donald Trump returns to the White House briefing room claiming he 'won' and suggests Pfizer held back vaccine to sabotage his election and says without him the drug would have taken four YEARS,94
517,517,3.0,politics_filtered_nov19,Trump turns to blocking state certification of U.S. election results after court losses,730
518,518,2.0,politics_filtered_nov19,Georgia confirms Biden victory and finds no widespread fraud after statewide audit,86
519,519,4.0,politics_filtered_nov19,"There's 'not a legal' or political path for Trump to remain in office, says Gore recount lawyer",7991
520,520,4.0,politics_filtered_nov20,Trump invites Michigan GOP state lawmakers to White House as legal challenges there fail,6791
521,521,5.0,politics_filtered_nov20,Joe Biden turns 78 today as he’s about to become the oldest sitting president,37
522,522,6.0,politics_filtered_nov21,"Plagued by COVID outbreaks, the meatpacking industry could be forced to change under Biden",117
523,523,4.0,politics_filtered_nov21,"U.S. Sen. Marsha Blackburn, a Trump ally, refers to Biden as 'president-elect'",11752
524,524,3.0,conservative_filtered_nov19,Lin Wood bombshell: 'Irrefutable evidence' of fraud in Georgia recount -- Attorney assisting campaign claims Trump won reelection in '70%-plus landslide',240
525,525,3.0,conservative_filtered_nov21,Lawyer working on Trump Pennsylvania effort placed under official protection due to threats,636
526,526,7.0,politics_filtered_nov21,"Ivanka Trump: How Dare You Investigate My Father for Tax Fraud, Which He Definitely Didn’t Use Me to Commit",18402
527,527,3.0,politics_filtered_nov20,Report: Trump reached out to GOP Wayne County canvassers who are now looking to reverse decision,7587
528,528,4.0,politics_filtered_nov19,Republican mayor from Michigan: ‘President Trump is deliberately lying to Americans’,9357
529,529,3.0,conservative_filtered_nov20,Joe Biden Keeps Lead in Georgia After Recount; Giuliani Says Recount ‘Means Nothing’,78
530,530,5.0,conservative_filtered_nov20,Elected DNC Member Floats Re-Education Camps for Trump Supporters,29
531,531,4.0,conservative_filtered_nov21,"While You Were Focused on The Kraken, the Senate Continued Confirming Trump Federal Judges",1878
532,532,2.0,politics_filtered_nov21,Arizona’s largest county certifies Biden win over Trump,7085
533,533,3.0,conservative_filtered_nov20,Romney: Surprising People Believe Trump's Fraud Claims,214
534,534,3.0,conservative_filtered_nov19,Trump Announces a Press Conference and a ‘Viable Path to Victory’,27
535,535,2.0,conservative_filtered_nov20,"Georgia recount results: Biden still ahead by 12,000 — but Trump has one last roll of the dice",116
536,536,4.0,politics_filtered_nov19,Trump summons Michigan GOP leaders for extraordinary meeting,100
537,537,5.0,politics_filtered_nov20,Donald Trump Undercuts American Democracy as he clings to power,66
538,538,3.0,politics_filtered_nov19,"Trump campaign drops Michigan election lawsuit, Rudy Giuliani says",3052
539,539,1.0,politics_filtered_nov21,Twitter will transfer presidential accounts to Joe Biden on Inauguration Day,95
540,540,4.0,politics_filtered_nov19,Buttigieg: Denying Biden intelligence briefings is about protecting Trump's 'ego',272
541,541,6.0,politics_filtered_nov21,Rudy Giuliani's Son Potentially Exposed Most of Trump's Legal Team to COVID During RNC Press Conference,20544
542,542,3.0,conservative_filtered_nov19,9 Key Points from Trump Campaign Press Conference on Challenges to Election Results,16
543,543,2.0,conservative_filtered_nov20,Lin Wood: President Trump won 400 electoral votes | One America News Network,9
544,544,1.0,politics_filtered_nov19,Trump's vaccine team will not brief Biden administration,162
545,545,4.0,politics_filtered_nov20,Trump’s press secretary Kayleigh McEnany heckled in briefing: ‘When will you admit you lost?’,5116
546,546,3.0,conservative_filtered_nov19,'Keep fighting': Second Trump rally in Washington set to protest electoral college vote,904
547,547,7.0,politics_filtered_nov20,New York expands Trump tax fraud investigations to include writeoffs: report,380
548,548,4.0,politics_filtered_nov19,Trump invites Michigan GOP state lawmakers to White House as legal challenges there fail,3501
549,549,8.0,conservative_filtered_nov19,One Of Biden’s First Admin Hires Helped Push Through China Trade Bill That Caused ‘Sharp Drop’ In US Jobs,143
550,550,4.0,politics_filtered_nov19,‘My Blood Is Boiling’: Ex-GOP Governor Torches Trump For Stonewalling Biden’s Transition,12286
551,551,1.0,politics_filtered_nov19,Trump's vaccine team will not brief Biden administration: U.S senator,198
552,552,4.0,conservative_filtered_nov21,"Catholics sounding alarm about Biden administration, conflicts with moral teachings",7
553,553,4.0,politics_filtered_nov21,Detroit asks judge to sanction Trump campaign for spreading 'disinformation',2300
554,554,4.0,politics_filtered_nov19,Duluth airport refused to host Pence event after Trump rally flouted safety rules,7236
555,555,1.0,conservative_filtered_nov21,Twitter says it will hand control of US president's official account to Joe Biden on January 20 - regardless of whether Donald Trump has left the White House,147
556,556,4.0,politics_filtered_nov19,"Giuliani, Trump Legal Team Melt Down In Insane Presser",2045
557,557,4.0,politics_filtered_nov19,"We Still Live In 2 Americas, Not 1 - The 2020 election saw more rich people vote for Trump then four years ago, while Joe Biden attracted more poor and low-income voters.",408
558,558,4.0,politics_filtered_nov21,Judge slaps down Trump appointee who has sought to reshape Voice of America and related agencies,3518
559,559,5.0,politics_filtered_nov21,"Merrick Garland Among Biden Candidates For Attorney General, Sources Say",19193
560,560,3.0,politics_filtered_nov19,Trump’s Last-Ditch Bid to Steal the Election: Install Loyal Electors,115
561,561,5.0,politics_filtered_nov20,A new beginning: We will survive our bad breakup with Donald Trump,144
562,562,8.0,politics_filtered_nov21,Trump's defeat by Joe Biden has triggered a huge wave of relief among the United States' European allies,47331
563,563,5.0,politics_filtered_nov19,Social Security Defenders Tell Biden to Keep Austerity-Obsessed Bruce Reed Far Away From the White House,116
564,564,6.0,politics_filtered_nov21,Trump’s failure to work with Biden is becoming more urgent as Covid spreads,298
565,565,4.0,politics_filtered_nov20,Trump’s election lawsuits plagued by elementary errors,205
566,566,4.0,politics_filtered_nov19,"Mike Shirkey, a Michigan Republican who will meet with Trump, said this week he would not override Biden’s victory.",95
567,567,6.0,conservative_filtered_nov21,'No national shutdown': Joe Biden says shutting down the virus will not require a national lockdown,551
568,568,3.0,politics_filtered_nov21,Michigan Republican leader is meeting with Trump at White House to discuss coup,10416
569,569,3.0,conservative_filtered_nov20,"Embarrassing Lapdog Biden Journalists Debase Their Profession in Latest Presser: ""What did you say to Americans, especially immigrant Americans who came to the United States, looking for political stability and are seeing all the things that the President is doing?""",26
570,570,3.0,conservative_filtered_nov20,"Sidney Powell: Absent software fraud, Trump 'had at least 80 million votes'",304
571,571,3.0,conservative_filtered_nov20,Trump Campaign Says It Has Uncovered Enough ‘Fraud’ To Overturn Election Result,1390
572,572,2.0,politics_filtered_nov21,Georgia Secretary of State Certifies Biden’s Win After Audit,9783
573,573,3.0,politics_filtered_nov21,A new lawsuit alleges Trump’s effort to overturn Michigan’s election results disenfranchises Black voters,528
574,574,3.0,politics_filtered_nov21,Trump’s last-ditch efforts to overturn results fail to make dent in Biden victory,109
575,575,3.0,politics_filtered_nov19,Donald Trump mounts all-out assault on election result in Michigan | President calls county officials in attempt to derail Biden victory | Plans to fly Republican lawmakers to meet with him in DC,531
576,576,4.0,conservative_filtered_nov19,Dear Joe Biden: are you kidding me? | Erin Brockovich,12
577,577,8.0,conservative_filtered_nov21,Ilhan Omar Urges Biden to ‘Reverse’ President Trump’s Middle East Agreements -- Thinks that peace between Israel and Arab nations is a bad thing.,40
578,578,3.0,politics_filtered_nov21,Who needs Russia? Loudest attacks on US vote are from Trump,217
579,579,4.0,politics_filtered_nov20,Poll: 61 percent of voters say it's important that Trump give concession speech,2614
580,580,4.0,conservative_filtered_nov20,Satire: Obama: 'Biden Has Touched Us All',65
581,581,1.0,politics_filtered_nov21,"Twitter will hand @POTUS to Biden on Inauguration Day, even if Trump doesn’t concede",8290
582,582,3.0,conservative_filtered_nov19,Trump Legal Team Holds Presser: ‘Trump Won In A Landslide. We Are Going To Prove It’ | The Daily Wire,40
583,583,5.0,politics_filtered_nov21,The Cabinet Appointments That Really Matter In The Incoming Biden Administration,14
