,Unnamed: 0,coding,group,title,score
584,584,2.0,politics_filtered_nov20,Georgia Secretary of State to certify election for Biden,104
585,585,1.0,politics_filtered_nov21,Trump to lose @POTUS Twitter account on January 20,94
586,586,5.0,politics_filtered_nov21,A destructive legacy: Trump bids for final hack at environmental protections,63
587,587,5.0,politics_filtered_nov21,"Trump considers targeting birthright citizenship with executive order in his last weeks in office, report says",1281
588,588,4.0,politics_filtered_nov20,Biden Must Keep His Word and Allow Investigations of Trump to Proceed,12450
589,589,3.0,politics_filtered_nov19,Trump-Appointed Judge Rejects Lin Wood’s ‘Creative’ Election Lawsuit in Georgia,155
590,590,3.0,politics_filtered_nov21,Trump tries to leverage power of office to subvert Biden win,348
591,591,2.0,politics_filtered_nov19,"Georgia Releases Hand Recount Results, Affirming Biden's Lead",55
592,592,1.0,politics_filtered_nov19,Trump to Biden transition must start immediately: Chamber of Commerce,1093
593,593,4.0,politics_filtered_nov20,Detroit Asks Court to Issue Sanction After Trump Campaign Lawyer Used Court Filing to ‘Spread Disinformation’,4278
594,594,5.0,politics_filtered_nov20,A Trump speechwriter who was sacked in 2018 for meeting white nationalists has been rehired to oversee US Holocaust memorials,17980
595,595,4.0,politics_filtered_nov21,Trump Campaign Lawyers File New Pennsylvania Motion Which Misspells Governor’s Name,388
596,596,3.0,conservative_filtered_nov20,"4th witness, also a Democrat saw perfect black marks on a stack of ballots ... 500 in a row all for Biden",588
597,597,7.0,politics_filtered_nov21,Federal Judge Strikes DOJ from the Docket in E. Jean Carroll’s Case Against Donald Trump,4586
598,598,4.0,politics_filtered_nov19,Trump campaign's stream of Giuliani press conference includes audio of people mocking him,1162
599,599,1.0,politics_filtered_nov21,US Chamber of Commerce chief calls on Trump to stop delaying transition to Biden presidency,1780
600,0,2.0,conservative_filtered_nov21,Lin Wood: President Trump won 400 electoral votes | One America News Network,36
601,1,5.0,politics_filtered_nov20,AOC and Cori Bush Join Protest Outside DNC to Push Biden on Climate Action,145
602,2,2.0,politics_filtered_nov19,Biden Maintains His Lead Over Trump as Georgia Recount Ends,57
603,3,4.0,conservative_filtered_nov21,Trump Touts New Rules to 'End Global Free Loading' of Prescription Drugs,67
604,4,6.0,politics_filtered_nov20,Trump Continues To Falsely Downplay COVID After US Death Toll Reaches 250k,317
605,5,5.0,politics_filtered_nov21,Latinas for Trump founder unseated Florida Democrat after ‘shadow candidate’ with his surname entered the race,57684
606,6,3.0,conservative_filtered_nov20,9 Key Points from Trump Campaign Press Conference on Challenges to Election Results,123
607,7,3.0,politics_filtered_nov21,Detroit voters sue Donald Trump over unsubstantiated claims of voter fraud,928
608,8,5.0,politics_filtered_nov21,Bypassing McConnell: Democrats push Biden to aggressively use executive power,10175
609,9,7.0,politics_filtered_nov20,"Once Out Of Office, Trump Faces Significant Legal Peril",94
610,10,3.0,conservative_filtered_nov21,Trump lawyers cited Minnesota counties in affidavit about Michigan: report,56
611,11,5.0,conservative_filtered_nov20,Biden marks Transgender Day of Remembrance,12
612,12,5.0,politics_filtered_nov19,Trump's firing of top election security official unsettles lawmakers,194
613,13,2.0,politics_filtered_nov20,"Republican Party sparks backlash with ""Trump won by a landslide"" post: ""What happened to you?""",858
614,14,4.0,politics_filtered_nov20,It’s time for everyone to pick a side: America or President Trump,489
615,15,5.0,politics_filtered_nov20,Biden set to meet with democratic leaders on Capitol Hill,82
616,16,7.0,politics_filtered_nov20,NY probes Trump consulting payments that reduced his taxes,767
617,17,2.0,politics_filtered_nov20,"Georgia election official says hand tally of presidential race is complete, the results affirm Biden’s lead over Trump",95376
618,18,4.0,conservative_filtered_nov20,Trump To Release “Clear Path To Victory” Today At High Noon!,452
619,19,7.0,politics_filtered_nov20,Tucker Carlson bashes Trump attorney Sidney Powell for lack of evidence in fraud claims: ‘She never sent us any’,414
620,20,4.0,politics_filtered_nov21,‘Do they just not care?’ Miami immigrants troubled by surge of Latino support for Trump,467
621,21,4.0,politics_filtered_nov21,It’s time for everyone to pick a side: America or President Trump,3645
622,22,2.0,conservative_filtered_nov20,"Georgia certifies election results, making Biden win official",52
623,23,1.0,politics_filtered_nov21,Twitter says it’s handing @POTUS account over to Joe Biden on Inauguration Day,699
624,24,3.0,politics_filtered_nov19,Non-Giuliani Trump Attorneys Admit Trump’s Claims of Election Fraud Are Bullshit,12890
625,25,4.0,conservative_filtered_nov19,AZ GOP Chair Dr. Kelli Ward Confident Election ‘Will Ultimately Be Decided in Favor of President Donald J. Trump’,267
626,26,4.0,politics_filtered_nov21,Most Republicans greet Trump’s push to overturn the election with a customary response: Silence,433
627,27,4.0,politics_filtered_nov20,Trump's Stupid Coup—Which Hasn't Failed Yet—Is Distracting Us From What Needs to Be Done,64
628,28,4.0,conservative_filtered_nov21,"Obama to produce Netflix series about Trump transition, unclear whether it will include abusing intel agencies to spy on successor",52
629,29,2.0,conservative_filtered_nov20,Georgia Secretary of State Certifies Biden’s Win After Audit,30
630,30,3.0,politics_filtered_nov21,"GOP Sen. Blackburn Calls Biden President-Elect, but Later Takes it Back",133
631,31,4.0,politics_filtered_nov20,Donald Trump Is Endangering America's National Security for His Ego,156
632,32,3.0,conservative_filtered_nov19,"3rd monitor, a Democrat: ""Hundreds of these ballots seemed impeccable, with no folds or creases. The bubble selections were perfectly made ... only observed selections in black ink, and all happened to be selections for Biden.""",1419
633,33,3.0,conservative_filtered_nov19,"In Nevada, A Corrupt Cash-For-Votes Scheme Is Hiding In Plain Sight -- In tribal areas, Native American nonprofits illegally offered gift cards, electronics, and other 'prizes' in an effort to get out the vote—for Joe Biden.",1062
634,34,3.0,conservative_filtered_nov19,"Georgia Republican Poll Watcher Discovered Recount Error Off By More Than 9,000 Votes Wrongly Given To Biden",1544
635,35,3.0,politics_filtered_nov20,Trump objects to counting thousands of Wisconsin ballots,95
636,36,3.0,politics_filtered_nov21,Pete Buttigieg May Be Contender For Biden’s Cabinet | NBC News NOW,28
637,37,3.0,conservative_filtered_nov19,"Sidney Powell: Absent software fraud, Trump 'had at least 80 million votes'",61
638,38,1.0,politics_filtered_nov19,Here’s a Timeline of the Presidential Certification Process That Trump Is Trying to Disrupt,146
639,39,3.0,politics_filtered_nov21,"Wall Street Journal Bails on Trump’s ‘Conspiracy Theory,’ Says Giuliani is Not a ‘Serious Practicing Attorney",2495
640,40,5.0,conservative_filtered_nov20,Joe Biden stays silent over proposed meeting with BLM founder,64
641,41,2.0,conservative_filtered_nov20,Joe Biden Holds Lead in Georgia After Hand Recount,106
642,42,2.0,politics_filtered_nov21,Georgia governor certifies presidential electors for Biden,8826
643,43,2.0,politics_filtered_nov21,Georgia certifies that Joe Biden won the recount,23362
644,44,4.0,conservative_filtered_nov20,"After Insulting Trump Voters For Years, NYT Writer Complains Reaching Out To Them Is A 'Waste Of Time'",131
645,45,4.0,politics_filtered_nov20,Biden calls Trump ‘most irresponsible president in American history’,12784
646,46,4.0,politics_filtered_nov21,Trump Is No Longer the Problem. His Army of Followers Is.,5163
647,47,4.0,conservative_filtered_nov21,"How Christianity Gained Cultural Momentum In The Trump Era -- Some celebrities are not just talking the talk, but they seem to be walking a walk that seems to counter what Hollywood culture promotes and accepts.",276
648,48,4.0,politics_filtered_nov21,Trump Is Staging a Comically Incompetent Coup — It would almost be possible to laugh at this debacle if the stakes weren’t so serious.,517
649,49,4.0,politics_filtered_nov21,"Most GOP Senators Stay Mum on Trump's Efforts to Challenge Election, After Washington Post Contacted All 53 of Them",778
650,50,1.0,politics_filtered_nov21,"Biden will receive @POTUS Twitter account on Jan. 20 even if Trump doesn't concede, company says",6116
651,51,3.0,politics_filtered_nov19,'Integrity still matters': the unlikely Republican standing up to Trump's voter fraud lies,711
652,52,4.0,conservative_filtered_nov20,National Democratic Party official suggests re-education for Trump supporters: 'How do you deprogram 75 million people?',39
653,53,4.0,politics_filtered_nov21,'Call His Bluff': Edward Norton's Viral Message On Trump,4296
654,54,5.0,politics_filtered_nov21,"Trump attacks big Pharma, announces programs to lower drug prices",28
655,55,3.0,politics_filtered_nov20,Biden campaign sees no legal basis for overturning Michigan result,411
656,56,1.0,politics_filtered_nov20,Democrats send letter to GSA head Emily Murphy demanding to know why the Biden-Harris transition has not begun,2410
657,57,4.0,conservative_filtered_nov21,Bigot: Joe Biden Lackey Wanted to Destroy Amy Coney Barrett Because She's Catholic,17
658,58,2.0,politics_filtered_nov20,"Georgia recount complete, and Biden is still the winner",7811
659,59,1.0,politics_filtered_nov21,Republican Senator Lamar Alexander urges Trump to begin Biden transition,19928
660,60,1.0,politics_filtered_nov21,Biden team solicits donations to fund presidential transition as Trump administration blocks federal money,118
661,61,1.0,politics_filtered_nov20,Donald Trump resigning is the most logical way his presidency could end,321
662,62,1.0,politics_filtered_nov21,Republican leaders swore an oath to defend the Constitution. That means telling Trump it’s over.,3978
663,63,5.0,conservative_filtered_nov21,"BLM, Squad members pushing Dems, Biden to abolish prison",81
664,64,3.0,politics_filtered_nov21,"Battered by failures to reverse Biden win, Trump, allies persist with fraud claims",120
665,65,3.0,conservative_filtered_nov19,Donald Trump Called to Support Michigan Canvassing Board Members After Threats,496
666,66,3.0,politics_filtered_nov20,Trump digs deeper into debunked conspiracy theories instead of embracing reality,170
667,67,3.0,politics_filtered_nov21,Senator Shirkey and Speaker Chatifeld’s names projected on Trump International Hotel,83
668,68,4.0,conservative_filtered_nov20,"Lin Wood Savagely Schools Fox News' Dana Perino, Who Suggested Dominion Should Sue Trump's Legal Team",34
669,69,3.0,politics_filtered_nov20,Trump accuses Pfizer and Moderna of working to stop his re-election,101
670,70,5.0,politics_filtered_nov21,Biden could announce Cabinet picks as soon as next week,81
671,71,1.0,politics_filtered_nov19,"Second stimulus check: GOP will move forward with stimulus once Trump exits, Biden says",9361
672,72,4.0,politics_filtered_nov20,I Grew Up Surrounded By Religious Fanatics. Here's What I Know About Trump Supporters.,91
673,73,3.0,politics_filtered_nov21,"GOP asks Michigan not to certify election results, citing ‘irregularities’ | The move follows speculation that Trump is seeking to persuade Michigan Republicans to override election results",9437
674,74,4.0,politics_filtered_nov20,GA secretary of state: I'm a proud Trump supporter but numbers don't lie,2933
675,75,3.0,politics_filtered_nov21,Republican Resistance Looms in the Senate for Biden’s Nominees,63
676,76,5.0,politics_filtered_nov21,"Biden is considering making Merrick Garland, denied Supreme Court seat, the attorney general",3474
677,77,6.0,conservative_filtered_nov21,Ben Carson credits Trump's action after becoming 'desperately ill' with COVID: 'Saved my life',41
678,78,3.0,politics_filtered_nov21,"Trump campaign ""seeking to disenfranchise Black voters"" with election fraud claims: lawsuit",122
679,79,3.0,politics_filtered_nov21,"A group of Michigan voters are suing the Trump campaign for disenfranchising Black voters, lawsuit alleges",870
680,80,3.0,conservative_filtered_nov19,Sidney Powell: Trump Won in a Landslide and We're Going to Prove It,176
681,81,1.0,politics_filtered_nov21,Twitter says it will give @POTUS account to Biden on Inauguration Day,79006
682,82,4.0,politics_filtered_nov20,"Obama says all Americans ‘should be troubled’ by Trump’s efforts to subvert democracy. ‘I’m less surprised by Donald Trump doing this, he has shown, you know, only a flimsy relationship with the truth,' says Obama",5670
683,83,4.0,politics_filtered_nov21,"Trump’s monumental sulk: president retreats from public eye as Covid ravages US | Two weeks after his defeat, Trump has gone from always present to effectively missing, behavior that many say is an unprecedented and dangerous",809
684,84,4.0,politics_filtered_nov20,Latinas for Trump founder unseated Florida Democrat after ‘shadow candidate’ with his surname entered the race,50923
685,85,3.0,politics_filtered_nov19,New Delays In Final Stage Of Census Could Foil Trump’s Plan To Rig It,321
686,86,4.0,conservative_filtered_nov21,Joe Biden loses it at reporter who asked about kids going back to classrooms - then tells press to leave,224
687,87,3.0,politics_filtered_nov19,Federal judge releases audio of hearing in Trump campaign's Pennsylvania lawsuit,165
688,88,1.0,politics_filtered_nov21,Twitter to Meet With Biden Transition Team on Transfer of Social Media Accounts From Trump Admin,1740
689,89,3.0,politics_filtered_nov20,‘Exhibit Q’: Lawyer Lin Wood Submits that Michigan Is Really Minnesota in Failed Pro-Trump Election Affidavit,792
690,90,1.0,politics_filtered_nov20,Trump May Need to Be Impeached and Removed Before Inauguration Day,54824
691,91,5.0,politics_filtered_nov20,Count on Biden to Restore the National Monuments Trump Trashed,128
692,92,4.0,conservative_filtered_nov20,Catholic Bishop: 'I Beg Mr. Biden to Repent of His Dissent From Catholic Teaching on Abortion &amp; Marriage',74
693,93,4.0,politics_filtered_nov21,Impeach the president again — Removal from office wouldn’t be the goal this time. It would be to prevent Trump from running again.,2024
694,94,8.0,politics_filtered_nov21,"With Trump sabotaging American democracy, the Russians don’t need to interfere",2317
695,95,4.0,politics_filtered_nov19,Report: Trump reached out to GOP Wayne County canvassers who are now looking to reverse decision,6493
696,96,1.0,politics_filtered_nov20,"Democrats lose patience with GSA's Biden transition delay, demand answers",592
697,97,6.0,politics_filtered_nov21,Trump Chooses Golf Over Virtual COVID-19 Meeting With World Leaders,195
698,98,5.0,politics_filtered_nov20,Why Trump Should Not Have Access to U.S. Intelligence After January 20,16927
699,99,6.0,politics_filtered_nov21,Trump does not participate in G-20 event on global pandemic preparedness,298
700,100,3.0,politics_filtered_nov21,Trump supporters plan D.C. rally two days before electoral college votes are cast,288
701,101,,politics_filtered_nov20,Is Trump Trying to Take the Economy Down With Him? | His Treasury secretary is shackling the nation’s central bank and closing an emergency program for local governments.,135
702,102,3.0,politics_filtered_nov21,Michigan group sues Trump campaign for alleged mass voter suppression,62287
703,103,,politics_filtered_nov19,Georgia's Republican Secretary of State and his wife received texts telling them they deserve 'to face a firing squad' as Trump escalated his attacks on election results,1234
704,104,3.0,conservative_filtered_nov20,Trump Campaign Lawyers: There is a Pattern of Planned Voter Fraud in Multiple States,317
705,105,3.0,conservative_filtered_nov19,"Trump Campaign Withdraws Lawsuit in Michigan After Wayne County 'Relief,' Says Giuliani",48
706,106,3.0,conservative_filtered_nov20,Mitt Romney issues scathing statement condemning President Trump's voter fraud claims,27
707,107,4.0,conservative_filtered_nov19,Trump To Release “Clear Path To Victory” Today At High Noon!,383
708,108,3.0,conservative_filtered_nov21,Whoa: Nearly a Third of Democrats Believe the Election Was Stolen From Trump,150
709,109,8.0,conservative_filtered_nov20,"New Senate report purportedly 'confirms' Biden family's business ties to Chinese, Russian governments",307
710,110,3.0,conservative_filtered_nov20,"Trump lawyers lay out voter fraud cases in Pennsylvania, Michigan and Wisconsin",96
711,111,3.0,politics_filtered_nov19,Detroit Asks Court to Issue Sanction After Trump Campaign Lawyer Used Court Filing to ‘Spread Disinformation’,72
712,112,2.0,politics_filtered_nov21,Michigan election staff recommend certification of Biden win,806
713,113,4.0,politics_filtered_nov20,Trump and Giuliani are the Republican Party,2677
714,114,6.0,conservative_filtered_nov20,Biden vows there will be no national shutdown,43
715,115,4.0,politics_filtered_nov20,"Senate GOP breaks 123-year tradition to pack courts with Trump’s judicial nominees in spite of loss. The latest judge approved by Mitch McConnell &amp; Co. is a 33-year-old lawyer who the Bar Assoc. rated “not qualified""",33002
716,116,4.0,politics_filtered_nov20,Solar Companies Ask Biden To Reverse Trump’s Biggest Blow To The Industry,1105
717,117,1.0,politics_filtered_nov20,Committee Chairs Summon GSA Head On Refusal to Grant Biden-Harris Team Access to Transition Resources,149
718,118,,politics_filtered_nov20,‘It’s Time for the State Bars to Come Get Their People’: Lawyers Eviscerate Trump Campaign’s ‘Nonsensical’ Press Conference,7376
719,119,6.0,politics_filtered_nov21,People Think Mnuchin Accidentally Said Trump Admin’s Most Honest Thing About COVID-19,202
720,120,4.0,conservative_filtered_nov20,Trump campaign lawyer under protection following ‘threats of harm’,36
721,121,5.0,conservative_filtered_nov19,Elizabeth Warren Calls for Biden to ‘Cancel Student Loan Debt for Tens of Millions of Americans’,23
722,122,4.0,politics_filtered_nov20,Trump apparently mistakes parody Twitter account for one run by his sister,87
723,123,4.0,conservative_filtered_nov19,"Ann Coulter: Gee, Why Can’t Trump Accept Defeat Like the Democrats?",37
724,124,3.0,politics_filtered_nov19,Judge rejects Trump supporter’s attempt to block election results,119
725,125,3.0,politics_filtered_nov21,'Certify the Results!': Michigan Lawmakers Blasted for 'Legitimizing a Fascist Coup Attempt' by Meeting With Trump,6225
726,126,3.0,politics_filtered_nov20,Trump Camp Outraged Georgia Recount Counted The Votes,2617
727,127,4.0,conservative_filtered_nov20,Intimidation Tactics Against Trump Lawyers Undermine Justice,30
728,128,4.0,politics_filtered_nov21,Trump's 'Death Star' strategy: Forcing a fight over states' electors,105
729,129,1.0,politics_filtered_nov20,The Case for Prosecuting Trump,160
730,130,3.0,politics_filtered_nov21,Trump steps on Michigan lawmakers' message in tweets after meeting,172
731,131,2.0,politics_filtered_nov19,Georgia expected to release results of Trump-Biden hand recount,580
732,132,5.0,politics_filtered_nov19,Trump Has Slashed Jobs At Nearly Every Federal Agency; Biden Promises a Reversal,124
733,133,7.0,politics_filtered_nov20,New York AG probes consulting payments to Ivanka that reduced Donald Trump's taxes,327
734,134,5.0,politics_filtered_nov19,Joe Biden says stimulus package stalled because Republicans fear retribution from Trump,57942
735,135,4.0,politics_filtered_nov19,The Only Way for Biden to ‘Move the Country Forward’ Is To Hold Trump To Account for his,884
736,136,6.0,politics_filtered_nov19,"Trump remains silent as US passes 250,000 COVID-19 deaths",148
737,137,4.0,conservative_filtered_nov20,"New York Times op-ed admits 'Trump was right,' Democrats 'wrong,' about keeping schools open ""Some things are true even though President Trump says them""",2194
738,138,4.0,politics_filtered_nov21,Trump’s last-ditch efforts to overturn results fail to make dent in Biden victory,80
739,139,4.0,conservative_filtered_nov19,"If Biden Can Take Power by Fraud, Our Republic Has Abolished Itself",365
740,140,4.0,conservative_filtered_nov21,Nancy Pelosi calls Trump a 'Psychopathic Nut',55
741,141,4.0,conservative_filtered_nov20,Do Trump’s Lawyers Know What They Are Doing?,1
742,142,3.0,conservative_filtered_nov19,Trump Campaign Requests Recount of Key Counties in Wisconsin,604
743,143,4.0,conservative_filtered_nov21,Chris Evans and Zach Braff Encourage Keeping Track of Trump ‘Enablers’,118
744,144,5.0,politics_filtered_nov21,"Rahm Emanuel Reportedly Being Considered for Biden's Cabinet, a Choice That Would Be a Slap in the Face to Black Voters",574
745,145,2.0,politics_filtered_nov19,Biden approaches 80 million votes in historic victory,16241
746,146,4.0,conservative_filtered_nov19,A Bad Sign? Trump Holds Blowout Clearance Sale On MAGA Hats,35
747,147,4.0,politics_filtered_nov21,"The Trump campaign’s much-hyped affidavit features a big, glaring error",587
748,148,2.0,conservative_filtered_nov19,"Ga. GOP: Biden got 9,626 votes in Dekalb County by mistake",897
749,149,2.0,politics_filtered_nov20,Joe Biden confirmed as Georgia winner after recount,58973
750,150,4.0,conservative_filtered_nov20,Atlanta Mayor Suggests Trump Would ‘Eat His Own Children’ To Advance Agenda | The Daily Wire,42
751,151,4.0,politics_filtered_nov19,Trump shared a video that featured a former administrator of QAnon's fringe message board spreading election misinformation,188
752,152,3.0,conservative_filtered_nov20,Tucker Carlson Unloads On Trump Lawyer Sidney Powell Over Wild Election Claims: The Truth Matters,270
753,153,5.0,conservative_filtered_nov20,Report: Biden’s proposed gun control plan could hit gun owners with $34 billion in taxes,8
754,154,4.0,conservative_filtered_nov20,Trump Legal Adviser Jenna Ellis Rips Media: ‘You Are Not Unbiased Jurors’,123
755,155,6.0,politics_filtered_nov21,"As world leaders meet to talk pandemic, Trump checks out and hits the links",398
756,156,3.0,politics_filtered_nov20,Romney accuses Trump of trying to ‘subvert the will of the people’ with election challenges,14129
757,157,3.0,politics_filtered_nov20,Trump’s Attempts to Overturn the Election Are Unparalleled in U.S. History,7835
758,158,6.0,politics_filtered_nov19,"Trump boasts coronavirus mortality rate is ‘85% down’ as US death toll hits 250,000",2727
759,159,6.0,politics_filtered_nov19,Whoopi Goldberg blasts Trump over COVID-19 spike: 'This blood is on his hands',202
760,160,4.0,politics_filtered_nov20,Shirkey and Chatfield: Your meeting with Trump is dangerous,231
761,0,1.0,politics_filtered_nov21,Trump's emotional state is 'quite fragile' after election loss,7814
762,1,1.0,politics_filtered_nov19,Chamber of Commerce CEO Tom Donohue urges Trump to not delay transition to Biden 'a moment longer',1252
763,2,1.0,politics_filtered_nov21,Twitter will hand @POTUS account to Biden on Inauguration Day,64
764,3,1.0,politics_filtered_nov21,Sen. Graham says Biden should have access to classified intelligence briefings,212
765,4,1.0,politics_filtered_nov20,Republican Senator Lamar Alexander urges Trump to begin Biden transition,8040
766,5,1.0,politics_filtered_nov21,"Blocked by Trump, Biden forced to use transition workarounds",125
767,6,1.0,politics_filtered_nov21,Biden will receive @POTUS Twitter account even if Trump refuses to concede,613
768,7,1.0,politics_filtered_nov21,"Business and World Leaders Move On as Trump Fights to Reverse Election | President-elect Joseph R. Biden Jr. is seizing the moment, not to aggressively confront the president he defeated, but to act presidential in his stead.",380
769,8,1.0,politics_filtered_nov21,Conservative News Site Warns Trump: 'Concede And Move On',2671
770,9,1.0,politics_filtered_nov20,Maryland Gov. Hogan: Trump’s refusal help Biden transition team is ‘outrageous’,159
771,10,1.0,politics_filtered_nov19,The next step is to start ignoring Trump altogether,3642
772,11,2.0,politics_filtered_nov19,"Georgia recount confirms Biden victory over Trump, says state election official",78
773,12,2.0,politics_filtered_nov19,Georgia election official says hand tally of presidential race affirms Biden’s lead over Trump,49
774,13,2.0,politics_filtered_nov21,Biden's popular vote lead over Trump stretches to more than 6m,1540
775,14,2.0,politics_filtered_nov20,Georgia certifies Biden as state's 2020 winner,387
776,15,2.0,politics_filtered_nov21,Biden's margin of victory widens as Trump's subversion efforts grow more frantic,1425
777,16,2.0,conservative_filtered_nov19,Georgia Audit Catches Third Batch Of Uncounted Votes Favoring Trump,503
778,17,2.0,politics_filtered_nov19,"JUST IN: Georgia Republican Secretary Of State Says ‘No Doubt’ Biden Won, Will Move To Certify Vote",77
779,18,2.0,conservative_filtered_nov19,"Michigan, 6:31 AM, 150,000 votes, 96% for Biden...nothing to see here",340
780,19,2.0,politics_filtered_nov19,Georgia Recount Confirms Biden Victory,61
781,20,2.0,politics_filtered_nov19,"Georgia election official says hand tally of presidential race is complete, the results affirm Biden’s lead over Trump",136
782,21,2.0,politics_filtered_nov19,Georgia manual recount confirms Biden victory,110
783,22,2.0,politics_filtered_nov21,Trump Camp Outraged Georgia Recount Counted The Votes,12341
784,23,2.0,politics_filtered_nov21,Trump options narrow as Michigan backs Biden win,798
785,24,2.0,conservative_filtered_nov20,"4th Georgia County Finds Memory Card With Uncounted Votes, Most for Biden",29
786,25,3.0,politics_filtered_nov20,Why Michigan’s Top Legislators Should Cancel that Meeting with Trump,2831
